Title,Artist,Count,Lyrics
Waiting For My Chance To Come,Noah And The Whale,6087086,"Well I'm just waiting for my chance to come Just a silhouette against the rising sun Watch the water, watch the sky Count the days as they go by I'm just waiting for my chance to come Well it takes real guts to be alone Going head to head with the great unknown But there is no sweeter sound, on the kings round I'm bound And just waiting for your chance to come 'Cause it's hard to feel like, you're worth something in this life When you're walking next to me, I can hear my body speak We're just waiting for a chance to come We're just waiting for a chance to come Your immortal smile is burned in me When I close my eyes its all see Among the canyons and the stars You're the guide inside my heart I'm just waiting for my chance to come And you're just looking for a way outta here Yeah, a way to see this old life all disappear Take a gamble on your heart, it will lead you through the dark You're just waiting for your chance to come 'Cause it's hard to feel like, you're worth something in this life When you're walking next to me, I can hear my body speak We're just waiting for a chance to come We're just waiting for a chance to come And no one's gonna get in my way Gonna figure it out for myself Yeah no one's gonna make me stay Gonna figure it out for myself 'Cause I don't need nothing I'm just waiting for my chance to come"
To Whom It May Concern,The Civil Wars,43377764,"Why are you so far from me? In my arms is where you are to be How long will you make me wait? I don't know how much more I can take  I missed you But I haven't met you Oh, but I want to How I do  Slowly counting down the days 'Til I finally know your name The way your hand feels round my waist The way you laugh, the way your kisses taste  I missed you But I haven't met you Oh, but I want to How I do  How I do  I've missed you But I haven't met you Oh, how I miss you But I haven't met you Oh, but I want to Oh, how I want to  Dear whoever you might be I'm still waiting patiently"
All My Days,Alexi Murdoch,53665085,"Well I have been searching all of my days All of my days Many a road, you know I've been walking on All of my days And I've been trying to find What's been in my mind As the days keep turning into night  Well I have been quietly standing in the shade All of my days Watch the sky breaking on the promise that we made All of this rain And I've been trying to find What's been in my mind As the days keep turning into night  Well many a night I found myself with no friends standing near All of my days I cried aloud I shook my hands What am I doing here All of these days For I look around me And my eyes confound me And it's just too bright As the days keep turning into night  Now I see clearly It's you I'm looking for All of my days Soon I'll smile I know I'll feel this loneliness no more All of my days For I look around me And it seems you've found me And it's coming into sight  As the days keep turning into night As the days keep turning into night And even breathing feels all right Yes, even breathing feels all right Now even breathing feels all right It's even breathing Feels all right"
Ho Hey,The Lumineers,514514449,"I been trying to do it right I been living a lonely life I been sleepin' here instead I been sleepin' in my bed I been sleepin' in my bed So show me family All the blood that I will bleed I don't know where I belong I don't know where I went wrong But I can write a song  I belong with you, you belong with me You're my sweetheart I belong with you, you belong with me You're my sweetheart  I don't think you're right for him Think of what it might have been if we Took a bus to Chinatown I'd be standin' on Canal, and Bowery And she'd be standin' next to me  I belong with you, you belong with me You're my sweetheart I belong with you, you belong with me You're my sweetheart  Love we need it now Let's hope for some Cause oh, we're bleedin' out  I belong with you, you belong with me You're my sweetheart I belong with you, you belong with me You're my sweetheart"
Song For Zula,Phosphorescent,64684807,"Some say love is a burning thing, that it makes a fiery ring Oh but I know love as a fading thing Just fickle as a feather in a stream See honey, I saw love, you see it came to me It put its face up to my face so I could see Yeah, then I saw love disfigure me Into something I am not recognizing You see the cage it called; I said come on in I will not open myself up this way again I lay my face to the soil, and all my teeth to the sand I will not lay like this for days now upon end You will not see me fall, or see me struggle to stand To be acknowledged by some touch from his gnarled hand You see the cage it called; I said come on in I will not open myself up this way again You see the moon is bright in that treetop night I see the shadows that we cast in the cold clean light Now my feet are gold, and my heart is white And we race out on the desert plains all night See honey, I am not some broken thing I do not lay here in the dark waiting for thee No my heart is gold and my feet are light And I am racing out on the desert plains all night Some say love is a burning thing, that it makes a fiery ring Oh but I know love as a caging thing Just a killer, come to call from some awful dream Ah and all you folks, you come to see You just stand there in the glass looking at me But my heart is wild and my bones are steam And I could kill you with my bare hands if I was free"
You Are the Best Thing,Ray LaMontagne,73850117,"Baby It's been a long day, baby Things ain't been going my way You know I need you here To clear my mind All the time And baby The way you move me, it's crazy It's like you see right through me and make it easier And believe me, you don't even have to try Oh, because  You are the best thing You are the best thing You are the best thing That ever happened to me  Baby We've come a long way Baby You know I hope and I pray that you believe me When I say this love will never fade away Oh, because  You are the best thing You are the best thing You are the best thing That ever happened to me  Both of us have know love before To come on up promising like the spring, to walk on out the door Our hearts are strong and our hearts are kind Let me tell you just exactly what is on my mind  You are the best thing You are the best thing You are the best thing That ever happened to me You are the best thing You are the best thing You are the best thing That ever happened to me Yeah, yeah Yeah, yeah, yeah Now, now, now, now"
Blue Skies,Noah And The Whale,15443447,"This is a song for anyone With a broken heart This is a song for anyone Who can't get out of bed  I'll do anything To be happy  Oh, 'cause blue skies are coming But I know that it's hard  This is the last song that I write While still in love with you This is the last song that I write While you're even on my mind  Cause it's time to leave Those feelings behind  Oh, 'cause blue skies are coming But I know that it's hard  I don't think that it's the end But I know we can't keep going I don't think that it's the end But I know we can't keep going  But blue skies are coming Oh, yeah, blue skies are coming Oh, blue skies are coming But I know that it's hard"
Calamity Song,The Decemberists,5652261,"(You and me in the war)  Had a dream You and me in the war of the end times And I believe California succumbed to the fault line We heaved relief As scores of innocents died  And the Andalusian tribes Setting the lea of Nebraska alight Till all that remains is the arms of the angels  Hetty Green Queen of supply-side bonhomie bone-drab You know what I mean On the road It's well advised that you follow your own bag In the year of the chewable Ambien tab  And the Panamanian child Stands at the Dowager Empress's side And all that remains is the arms of the angels And all that remains is the arms of the angels  Ah ooh Ah ooh, ooh, oh Ah ooh Ah ooh, ooh, oh  And you've receded into loam And they're picking at your bones We'll come home We'll come home  Quiet now Will we gather to conjure the rain down? Will we now Build a civilization below ground? And I'll be crowned the community kick-it-around  And the Andalusian tribes Setting the lea of Nebraska alight 'Til all that remains is the arms of the angels 'Til all that remains is the arms of the angels  Ah ooh Ah ooh, ooh, oh Ah ooh Ah ooh, ooh, oh Ah ooh Ah ooh, ooh, oh Ah ooh Ah ooh, ooh, oh"
Live And Die,The Avett Brothers,26758407,"All it'll take is just one moment And you can say goodbye to how we had it planned Fear like a habit, run like a rabbit out and away Through the screen door to the unknown  And I wanna love you and more I wanna find you and more Where do you reside? When you hide, how can I find you? Cause I wanna send you and more I wanna tempt you and more Can you tell that I am alive? Let me prove it  You and I, we're the same Live and die, we're the same Hear my voice, know my name You and I, we're the same  Left like a pharaoh, sing like a sparrow anyway Even if there is no land or love in sight We bloom like roses, lead like Moses out and away Through the bitter crowd to the daylight  And I wanna love you and more I wanna find you and more Can you tell that I am alive? Let me prove it to you  You and I, we're the same Live and die, we're the same You rejoice, I complain But you and I, we're the same Live and die, we're the You and I, we're the same Hear my voice, know my name You and I, we're the same  I wanna love you and more I wanna find you and more Where do you reside? When you hide, how can I find you? Cause I wanna send you and more I wanna tempt you and more Can you tell that I am alive? Let me prove it  You and I, we're the same Live and die, we're the same You rejoice, I complain But you and I, we're the same Live and die, we're the same You and I we're the same Hear my voice, know my name You and I, you and I"
The Almond Tree,Hannah Peel,661063,"Temperance the dear old deer Did not dare to bother anyone's ear With her uptight jaw and hair tightly pinned Who'd have thought the sin to be within? Bury me under the almond tree If anything should happen to me Late last june I heard a cry I ran to see my younger sister die The poisoned meat had cut deep inside I cast my revenge on temperance tonight Bury me under the almond tree If anything should happen to me Bury me under the almond tree If anything should happen to me I walked for months through the rain and pour No sign of temperance and her deathly paw I start to think did I dream it all up What revenge is this, its my life now that's been caught Bury me under the almond tree If anything should happen to me Bury me under the almond tree If anything should happen to me"
Slow It Down,The Lumineers,107488991,"I feel her filth in my bones Wash off my hands til it's gone The walls they're closing in With velvet curtains  Some love was made for the lights Some kiss your cheek and goodnight Lift up a red high heel Lock up your doors with steel  They're makin' noise in my street My blinds are drawn I can't see Smashed in my car window Didn't touch the stereo  Slow it down, Angie come back to bed Rest your arms, and rest your legs  Act like you've been here before Smile less and dress up some more Tie up your scarf real tight These boys are out for blood tonight  Slow it down, Angie come back to bed Rest your arms, and rest your legs  And when she stood she stood tall She'll make a fool of you all Don't ask for cigarettes She ain't got nothing left for you  I never, she never, we never looked back That wasn't what we were good at And when it came to love We were not good enough on  Slow it down, Angie come back to bed Rest your arms, and rest your legs Don't you frown when you're feelin like that Only love can dig you out of this"
Little Lion Man,Mumford & Sons,284923739,"Weep for yourself, my man You'll never be what is in your heart Weep Little Lion Man You're not as brave as you were at the start Rate yourself and rake yourself Take all the courage you have left And waste it on fixing all the problems That you made in your own head  But it was not your fault but mine And it was your heart on the line I really fucked it up this time Didn't I, my dear? Didn't I, my  Tremble for yourself, my man You know that you have seen this all before Tremble Little Lion Man You'll never settle any of your scores Your grace is wasted in your face Your boldness stands alone among the wreck Now learn from your mother Or else spend your days biting your own neck  But it was not your fault but mine And it was your heart on the line I really fucked it up this time Didn't I, my dear? But it was not your fault but mine And it was your heart on the line I really fucked it up this time Didn't I, my dear? Didn't I, my dear? Haa-a-a-a Ha-a-a-a-a-a Ha-a-a-a-a-a Ha-a-a-a-a-a Ha-a-a-a-a Ha-a-a-a-a  But it was not your fault but mine And it was your heart on the line I really fucked it up this time Didn't I, my dear? But it was not your fault but mine And it was your heart on the line I really fucked it up this time Didn't I, my dear? Didn't I, my dear?"
Home,The Falls,972431,"Weary blues from waitin' Lord, I've been waitin' too long These blues have got me cryin' Oh, sweet mama, please come home  The snow falls 'round my window But it can't chill my heart God knows it died the day you left My dream world fell apart  Weary blues from waitin' Lord, I've been waitin' too long These blues have got me cryin' Oh, sweet mama, please come home  Thru tears I watch young lovers As they go strollin' by Oh, all the things that might have been God forgive me if I cry  Weary blues from waitin' Lord, I've been waitin' too long These blues have got me cryin' Oh, sweet mama, please come home"
Pictures,Benjamin Francis Leftwich,34749623,"If you crash a car into your best friend's house Would you be quiet as words came out of their mouth? 'Stop, don't do it, I have been waiting for it Stop, I knew it would come' If you find a guard next to your girlfriend's bed Would it be hard to sort out your spinning head? Stop, don't say that, dear, that you wanted him here Stop, don't give him the clear Take a picture of them Take a picture of them If you are afraid, don't be I have the whole thing planned We'll start in the ocean, baby, and when we find the land We will be thankful to all of our friends That they didn't leave us as we got to the end Take a picture of them Take a picture of them Take a picture of them Take a picture of them If you find your faith in your parents' god Don't be so quick to point out the flaws in it You've been around and you've seen the way that things work But you need a compass to get around your house"
gun-shy,Grizzly Bear,7599733,"The sky keeps staring at me Frozen in my tracks (Nothing else to see) And when I move my face left You're always standing there (A shadow I can't see) And even then I can't trace You're walking away  I put my ears to the ground Always pushing down (Nothing I can hear) I found the worst half in me I'm cut off at the knees (Can't even take a stand) Against your words and beliefs I didn't want to freeze  (All of the years, leaving me here Gun-shy) I don't want to say it all again (the pain, losing my aim) Never seem to see (And why?) Do I always feel it all the same The blisters in my eyes (Recite) A guide that has only led me stray And even as I limp (you smile)  The cold keeps tearing at me Slowing down my blood (Unable to speak) I left my mind long ago Choosing something false (Always letting go) And when I try to face you You're walking away  (All of the years, leaving me here Gun-shy) I don't want to say it all again (the pain, losing my aim) Never seem to see (And why?) Do I always feel it all the same The blisters in my eyes (Recite) A guide that has only led me stray And even as I limp (you smile)"
Now That I Know,Devendra Banhart,3315367,"Now that I know The way it goes You gotta pay back every penny that you owe Twelve years old In your mama's clothes Shut the blinds and lock up every door And if you hear Someone's comin near Just close your eyes and make them disappear now Years away Finds me here today On my own, always on my way now So I send my friends Gifts from where I've been Something for the hand they're never there to lend Better keep those eyes Climbing paradise And don't pretend you won't reach it in the end now Dearest dear I know you been here Why'd you run tell me why'd you disappear now That you're not Here with me Seems to be the only time that I can see you clearly I may not know How to treat or give you what you need But I am a gentleman who says what he means now And now I sing Upon my knees And praise the kindness of a gentle breeze I see it swell Like a story in me to tell Told years away and past my baby dying So you raise them up To heaven always hell They're unaware, share, give a hand to help son Oh you give them away But they'll come back to you someday Wanna know why nobody was ever there to help them And no it ain't fair And if God forbid you care It's enough to get you in a whole lotta trouble Oh realize It ain't wise to idealize Or put your life in the hands of any struggle Never renounce Or ever claim to be And never buy that freedom just ain't free now Ella sang Sifting in the sand Like a hymn within to help us understand Heaven awaits We're making our last stand Glory bound and sparrow in our hand"
Grown Ocean,Fleet Foxes,7917802,"In that dream, I'm as old as the mountains Still as starlight reflected in fountains then Children grown on the edge of the ocean Kept like jewelry, kept with devotion In that dream moving slow through the morning time  You would come to me then, without answers Lick my wounds and remove my demands for now Eucalyptus and orange trees are blooming In that dream, there's no darkness a-loomin' In that dream, moving slow through the morning time  In that dream I could hardly contain it All my life I will wait to attain it Then, then, then, oh  I know someday the smoke will all burn off All these voices I'll someday have turned off then I will see you someday when I've woken I'll be so happy just to have spoken I'll have so much to tell you about it then Ah, ah, ah  In that dream I could hardly contain it All my life I will wait to attain it Then, then, then, oh  Wide-eyed walker, don't betray me I will wake one day, don't delay me Wide-eyed leaver, always going"
The Motherlode,The Staves,3823928,"Counting the winters, numb to the cold Searching the valley, for secrets untold The mountains are children, to someone so old A king without kingdom or throne Digging the mud and the stone All men have left here But you have remained At the banks of the river, forever the same Though no water flows here, the memory stays As long as it stays you are here Heart broken year after year People running away, running like strangers day after day Leave him alone Golden river running from her home The sun was an altar, before reaching out And raised up the dagger, that hung from his belt He cursed his delusion and the sadness he felt Weeping at what he'd become, just a fool in the gold of the sun People running away, running like strangers day after day Leave him alone Golden river running from her home Golden river running from her home Golden river running from her home Golden river running from her home"
Country Dumb - Piano Version,Josh T. Pearson,274945,"I come from a long line in history of dreamers Each one more tired than the one before All of us too poor to pay attention Sweet dreamin' was all we could afford They say that even in the worst hope overcometh But not in this cold lonely world of mine So if your warm thoughts ever wander up to good heavens Say a prayer of hope for my driftin', sweet dreamin' mind We are not what you call over-comers We are failures each and every one Were the kind who will always need a Saviour The kind who play country dumb I come from a long line in history of dreamers Too broke down to frankly my dear give a good god dime Too poor in spirit to rent to own it alone Even qualify for that ever elusive pre-approved new lease on life We're the kind who never take responsibility Yeah the only thing I will ever take from you will be my leave And the only good thing I'll ever give to you will be my good grief I've counted the cost sister Christian I know that Jesus saves cuz nothing in this cold lonely world is for free! There are reasons that I was alone when I met you Reasons that go back a long long way in time There are reasons that I am surely going to leave you They come from a circle in history woman that ain't hardly even mine And in this unbroken circle I will be the first at the end of the line We're the kind who start the books but who just do not finish We're the kind who have 10,000 would-be-great, ungrateful, too-long, run-on songs We're the kind still stuck in the past but who see well into the circle future You see I miss you woman and baby you ain't even yet gone You see I miss you babe and woman you ain't even yet gone I come from a long line in history of dreamers Each one more tired than the one before All of us too poor to pay attention Sweet dreamin' was all we could afford We are not what you call over-comers We are failures each and every one Were the kind who will always need a Saviour The kind who play country dumb The kind who play country dumb"
Main Street,Deer Tick,1663686,"I can't sleep, I can't close my eyes Blink for one second and the whole world pass you by Yeah, I guess, I meant All the days you spent  I can't eat, I can't use my mouth Miss one day and the whole world casts you out Yeah, I guess, I tried All the times I lied  Goodbye time, you ain't on my side Satisfaction, too much of mine Some girls here, never let me down Oh, but main street seems so lonely now  I can't hear, I can't use my ears Miss one speech and you're uninformed to tears Yeah, I guess, I'm scared Every time I cared  I can't breathe, I can't use my nose Missed one night from this stomped on bag of blow Yeah, I guess, I'm wrong I can't sing this song  Goodbye time, you ain't on my side Satisfaction, I got way too much of mine Some girls here, never let me down Oh, but main street seems so lonely now  I can't write, I can't bleed my soul Lose one friend and your whole mind finds it's hole Yeah, I guess, you're strong But I knew that for sure  Speak to me again And I'll never have felt it, before"
Wolf,First Aid Kit,46276101,"Wolf mother, where you been? You look so worn, so thin You're a taker, devil's maker Let me hear you sing, hey ya hey ya Wolf father, at the door You don't smile anymore You're a drifter, shapeshifter Let me see you run, hey ya hey ya  Holy light Oh burn the night, oh keep the spirits strong Watch it grow, child of woe Keep holding on  When I run through the deep dark forest long after this begun Where the sun would set, trees were dead and the rivers were none And I hope for a trace to lead me back home from this place But there was no sound, there was only me and my disgrace Hey, hey-hey, hey, hey Hey, hey-hey, hey, hey Hey, hey-hey, hey, hey Hey, hey-hey, hey, ya  Wolf mother, where you been? You look so worn, so thin You're a taker, devil's maker Let me hear you say, hey ya hey ya Wolf father, at the door You don't smile anymore You're a drifter, shapeshifter Let me see you run, hey ya hey ya  Wayward winds The voice that sings of a forgotten land See it fall, child of woe Lend a mending hand  When I run through the deep dark forest long after this begun Where the sun would set, trees were dead and the rivers were none And I hope for a trace to lead me back home from this place But there was no sound, there was only me and my disgrace Hey, hey-hey, hey, hey Hey, hey-hey, hey, hey Hey, hey-hey, hey, hey Hey, hey-hey, hey, ya"
Santa Fe,Beirut,33566363,"Your days in one This day undone The kind that breaks under All day at once For me, for you I'm just too young And what of my heart This day was once Silence before All grace of lost Can't wait at all Can't wait at all Temptation won  And whatever comes through the door I'll see it face to face All by your place  Sign me up Santa Fe And call your son Sign me up Santa Fe On the cross Santa Fe And all I want Sign me up Santa Fe And call your son And I and I and I alone want you to know And I and I and I alone And I and I and I alone want you to know And I and I and I alone  Your days in one This day undone The kind that breaks under All day at once For me, for you I'm just too young And what of my heart  Sign me up Santa Fe And call your son Sign me up Santa Fe On the cross Santa Fe And all I want Sign me up Santa Fe And call your son"
Cats and Dogs,The Head and the Heart,13963961,Somewhere underneath The floorboard I will sweep my garden Underneath the cupboard Lives a mouse And he discovered There was nothing there Nothin' there to discover Fallin' from the sky There are raindrops in my eyes And my thoughts are diggin' in the backyard My roots have grown but I don't know where they are Don't know where they are I don't know where they are My roots have grown but I don't know where they are Cats and dogs and rooster calls Telephones and pay phone stalls They take away The lonely days For now They take away The lonely days For now
