Title,Artist,Count,Lyrics
The Boxer,Simon & Garfunkel,110179523,"I am just a poor boy though my story's seldom told I have squandered my resistance for a pocketful of mumbles, such are promises All lies and jest, still a man hears what he wants to hear And disregards the rest, hmmmm  When I left my home and my family, I was no more than a boy In the company of strangers In the quiet of the railway station, runnin' scared, laying low Seeking out the poorer quarters, where the ragged people go Looking for the places only they would know  Lie la lie, lie la lie la lie la lie Lie la lie, lie la lie la lie la lie, la la lie la lie  Asking only workman's wages, I come lookin' for a job But I get no offers Just a come-on from the whores on 7th Avenue I do declare, there were times when I was so lonesome I took some comfort there, lalalalalalala  Now the years are rolling by me They are rockin' evenly I am older than I once was And younger than I'll be; that's not unusual Nor is it strange After changes upon changes We are more or less the same After changes we are more or less the same  Lie la lie, lie la lie la lie la lie Lie la lie, lie la lie la lie la lie, la la lie la lie  And I'm laying out my winter clothes and wishing I was gone Goin' home Where the New York City winters aren't bleedin' me Leadin' me Goin' home  In the clearing stands a boxer, and a fighter by his trade And he carries the reminders Of every glove that laid him down or cut him 'Til he cried out in his anger and his shame 'I am leaving, I am leaving', but the fighter still remains  Lie la lie, lie la lie la lie la lie Lie la lie, lie la lie la lie la lie, la la lie la lie Lie la lie, lie la lie la lie la lie Lie la lie, lie la lie la lie la lie, la la lie la lie Lie la lie, lie la lie la lie la lie Lie la lie, lie la lie la lie la lie, la la lie la lie Lie la lie, lie la lie la lie la lie Lie la lie, lie la lie la lie la lie, la la lie la lie Lie la lie, lie la lie la lie la lie Lie la lie, lie la lie la lie la lie, la la lie la lie Lie la lie, lie la lie la lie la lie Lie la lie, lie la lie la lie la lie, la la lie la lie Lie la lie, lie la lie la lie la lie Lie la lie, lie la lie la lie la lie, la la lie la lie Lie la lie, lie la lie la lie la lie Lie la lie, lie la lie la lie la lie, la la lie la lie Lie la lie, lie la lie la lie la lie Lie la lie, lie la lie la lie la lie, la la lie la lie"
"Puff, the Magic Dragon - Remastered","Peter, Paul and Mary",15664539,"Puff, the magic dragon Lived by the sea And frolicked in the autumn mist In a land called Honalee  Little Jackie Paper Loved that rascal Puff And brought him strings and sealing wax And other fancy stuff  Oh, Puff, the magic dragon Lived by the sea And frolicked in the autumn mist In a land called Honalee Puff, the magic dragon Lived by the sea And frolicked in the autumn mist In a land called Honalee  Together they would travel On a boat with billowed sail Jackie kept a look-out Perched on Puff's gigantic tail  Noble kings and princes Would bow whene'er they came Pirate ships would lower their flags When Puff roared out his name  Oh, Puff, the magic dragon Lived by the sea And frolicked in the autumn mist In a land called Honalee Puff, the magic dragon Lived by the sea And frolicked in the autumn mist In a land called Honalee  A dragon lives forever But not so, little boys Painted wings and giants' rings Make way for other toys  One grey night it happened Jackie Paper came no more And Puff, that mighty dragon He ceased his fearless roar  His head was bent in sorrow Green scales fell like rain Puff no longer went to play Along the cherry lane  Without his lifelong friend Puff could not be brave So Puff, that mighty dragon Sadly slipped into his cave  Oh, Puff, the magic dragon Lived by the sea And frolicked in the Autumn mist In a land called Honalee Puff, the magic dragon Lived by the sea And frolicked in the Autumn mist In a land called Honalee"
"Hinnom, TX",Bon Iver,26534282,"Fall in Fall out Fall along  In the first of light Past the Noachide Bodies wrapped in white Stranded every pain Baby, pasts are slain 'I got outta La Grange'  In Hinnom All this time With your heart in mind Didn't you edit? In Hinnom Go, the least And the precious feast The in-vetted  Sand, it starts to steal Dirt and ice imbed in cheeks In the potter's field (Solar peace Well, it swirls and sweeps You just set it) Strangers scattering Nether passage in the wind Off pennant tension ring (Armor, down On the wettest ground Not to vet it)"
Just a Boy,Angus & Julia Stone,18626307,I bit my tongue in the arc of conversation I don't know why I don't know why I met you once and I'd fallen for your notions I don't know why I don't know why Do you believe that there's treasures in the ocean? Did I say I'm just a boy? One kiss from you and I'm drunk up on your potion That big old smile is all you wore  Girl you make me want to feel Things I've never felt before Girl you make me want to feel Did I say I'm just a boy? Did I say I'm just a boy? You can hold me to that No lonely hands grab my suitcase full of nothing I don't know why I don't know why You took me in gave me something to believe in That big old smile is all you wore
Gracious,Ben Howard,25553656,"How would you know? When everything around you's Changing like the weather A big black storm And who would you turn to? Hide a ghost, a shadow at the most Would you let me know? Cause I don't want to trouble your mind with The childish design of how it all should go But I love you so When it all comes clear When the wind is settled I'll be here, you know Cause you said ours were the lighthouse towers The sun upon that place Darling I'll grow weary, happy still With just the memory of your face Gracious goes the ghost of you And I will never forget the plans and the Silhouettes you drew here, no And gracious goes the ghost of you, my dear How would you know? When everything around you's Bruised and battered Like the cold night storm And who would you turn to? Well, had I a ghost, a shadow at the most, would you tell me so? Cause I, I adore you so When it all comes clear The wind is settled, I'll be here, you know Cause you said ours were the lighthouse towers The sun upon that place Darling, I'll grow weary, happy still With just the memory of your face Gracious goes the ghost of you And I will never forget the plans and the Silhouettes you drew here And gracious goes the ghost of you, my dear Gracious goes the ghost of you And I will never forget the plans and the Silhouettes you drew here And gracious goes the ghost of you, my dear"
The Road,Mirel Wagner,524852,The hay hung low Where the road leads I will go And it's a hard and a crooked life When you're a dead man's unwedded bride The hay moves slow Where the road leads no one knows And it's a hard and a crooked life When you're a dead man's unwedded bride Down by the road sits a man Who's gray and old Says the hardest thing I know Is to see your loved ones go Down goes the road Where the wildflowers grow There's a lake that's dark deep and cold There I shall lay my bones Down I go Gonna lay my bruised bones And the hardest thing they'll know Just let go Just let me go
Ghosts,The Head and the Heart,8244429,"Boys in the street are talking about leaving, they're leaving Looking for places to go Boys in the street are talking about leaving, they're leaving Looking for places to go Andy built his coffin down in Carolina Told me he was running from something But I think he's just out chasing girls When Mary moved all of her shit to Chicago Her mother made sure that she left with her Bible But you won't find her face on Sundays  All my friends are talking about leaving, about leaving But all my friends are sitting in their graves All my friends are talking about leaving, about leaving But all my friends are sitting in their graves Is it any wonder why we all leave home? People say, 'I knew you when you were six years old' And you say, 'But I've changed, I've changed, I've changed, I've changed.' Mom and Dad, if only you could see me now Been here for a year and now I own this town Cause I've changed, I've changed, I've changed, I've changed  All my friends are talking about leaving, about leaving But all my friends are sitting in their graves All my friends are talking about leaving, about leaving But all my friends are sitting in their graves One day we'll all be ghosts Tripping around in someone else's home One day we'll all be ghosts, ghosts, ghosts Ghosts, ghosts, ghosts One day we'll all be found No longer lost, we're just hanging around One day we'll all be found, found, found Found, found, found"
Babel,Mumford & Sons,99499887,"Cause I know that time has numbered my days And Ill go along with everything you say But Ill ride home laughing, look at me now The walls of my town, they come crumbling down And my ears hear the call of my unborn sons And I know their choices color all Ive done But Ill explain it all to the watchmans son I never lived a year better spent in love  'Cause I know my weakness know my voice And I believe in grace and choice And I know perhaps my heart is farce But Ill be born without a mask (Woo!)  Like the city that nurtured my greed and my pride I stretch my arms into the sky I cry Babel! Babel! Look at me now Then the walls of my town, they come crumbling down You ask where will we stand in the winds that will howl As all we see will slip into the cloud So come down from your mountain and stand where weve been You know our breath is weak and our body thin  Press my nose up to the glass around your heart I shouldve known I was weaker from the start Youll build your walls and I will play my bloody part To tear, tear them down Well, Im gonna tear, tear them down  'Cause I know my weakness know my voice And I believe in grace and choice And I know perhaps my heart is farce But Ill be born without a mask"
River Love,Angus Stone,1320217,Headed north to San Francisco Wild horses in my head See her looking out the window Will she bring roses when I'm dead Do I love her for her beauty Do I love her she makes me smile Do I love her cause it's my duty But I guess we'll never really know I guess we'll never really know Will we ever really know Ah la la la la la la la Really know Headed north to San Francisco Wild horses in my head See her looking out the window Will she  bring roses when I'm dead Will she  bring roses when I'm dead Ah la la la la la la la Ah la la la la la la la
Criminals,The Tallest Man On Earth,4500663,"Well there were days when you thought you would just go under And the weekends that you never understood When you flew from the bar only seventeen You didn't bleed and no one ever thought you would And there where straights and lines and every sorts of options To stay away from broken mirrors in your friends But the summer was strung with some mighty thread And no law would never wait around no bend (Chorus) Come see the hiding in rain, come see the stillness in all them ones Come see the loveable strain of someone diving for all you know Come see the strain of a reeling tribe Come meet the criminals, of this Napoleon ride And there were the nights when you thought we would just surrender To the stories of the miracles of gulls When you flew from your sheets where your hours gone You never sleep and no one ever thought you would Come see the hiding in rain, come see the stillness in all them ones Come see the loveable strain of someone diving for all you know Come see the strain of a reeling tribe Come meet the criminals, of this Napoleon ride There are illusions and then just not even wanting To walk around a shiny peak of snow What a picture that is to be saved for us How it's standing like it's just for us to know (Chorus Variation) There was a time in my life when I was carried by all of you Now I run like a man still don't know what I dive into Come see the strain of a reeling tribe Come meet the criminals, of this Napoleon ride"
Lover Is Childlike,The Low Anthem,2242307,"Meet me down by the whale watch Meet me down by the sea Meet me down at Coney Island We'll go out on the sea So don't ask me no questions Cause I don't cry no wolf Back through the winds of the Ferris wheel See your doubt in the surf  You might think she's Christ-like But my lover is childlike  See the fish swimming upstream Back to the hills Want no part in the whale watch If you couldn't tell  My lover ain't Christ-like But my lover is childlike  She don't care for country In her tatters and rags As the band plays the anthem She whispers, 'God hates flags'"
Blue Ridge Mountains,Fleet Foxes,36167211,"Lie down with me my dear, lie down Under stormy night, tell nobody  My brother, where do you intend to go tonight? I heard that you missed your connecting flight To the Blue Ridge Mountains, over near Tennessee  You're ever welcome with me any time you like Let's drive to the countryside, leave behind some green-eyed look-a-likes So no one gets worried, no So no one gets worried, no  But Sean, don't get careless I'm sure it'll be fine I love you, I love you Oh, brother of mine  In the quivering forest Where the shivering dog rests Our good grandfather Built a wooden nest And the river got frozen And the home got snowed in And a yellow moon glowed bright Till the morning light  Terrible am I, child? Even if you don't mind  In the quivering forest Where the shivering dog rests Our good grandfather Built a wooden nest And the river got frozen And the home got snowed in And a yellow moon glowed bright Till the morning light  Terrible am I, child? Even if you don't mind, no"
Barton Hollow,The Civil Wars,31018001,"I'm a dead man walking here But that's the least of all my fears Ooh, underneath the water It's not Alabama clay That gives my trembling hands away Ooh, please forgive me, Father  Ain't going back to Barton Hollow Devil gonna follow me e'er I go Won't do me no good washing in the river Can't no preacher man save my soul  Did that full moon force my hand? Or that unmarked hundred grand? Ooh, underneath the water Ooh, please forgive me, Father  Miles and miles in my bare feet Still can't lay me down to sleep If I die before I wake I know the Lord, my soul won't Take I'm a dead man walking I'm a dead man walking Just keep walking and running and running for miles Keep walking and running and running for miles Keep walking and running and running for miles  Ain't going back to Barton Hollow Devil gonna follow me e'er I go Won't do me no good washing in the river Can't no preacher man save my soul"
Lump Sum,Bon Iver,32626223,"Sold my cold knot A heavy stone Sold my red horse for a venture home To vanish on the bow Settling slow Fit it all, fit it in the doldrums Or so the story goes Color the era Film it is historical Ahh, ahh, ahh  My mile could not Pump the plumb In my arbor 'til my ardor trumped Every inner inertia, lump sum All at once Rushing from the sub-pump Or so the story goes Balance we won't know We will see when it gets warm Ahh, ahh, ahh"
Morning Song,The Lumineers,29513609,"The carbonation in my drink The bubbles rise while my heart sinks And all I tend to do is think of you Was it easier to pack your bags And book that flight to Paris As the plane began to move that afternoon And when all the trains have pulled away From local stations in decay Its I who waits, its you whos late again And did you think of me when you made love To him, was it the same as us Or was it different, it must have been And all the pretty dames Theyll hug and kiss you all the same And when they go, theyre gone Theyre not running late Oh all, all the pretty dames And the kids you hold in your arms With promises to protect them from harm But they grow, and they go And youre all alone All the kids, all the kids that you hold And its a shame that it ends this way With nothing left to say So just sit on your hands, while I walk away Its a shame, its a shame, its a shame When my hands begin to shake When bitterness is all I taste And my car wont stop Cause I cut the brakes I hold on to a hope in my fate Oh oh ah ah hey hey May you return to love one day Well I hope and I pray You get what you gave Oh oh ah ah hey hey"
Victory,Trampled by Turtles,8141545,"All of us lonely, it ain't a sin To want something better than the shape your in The rain came at the break of day Your light in the windowpane said, 'come on in'  Its a broken heart, babe, I know the sound Feels like your hands, are nailed to the ground But it'll pass just like everything else You won't let it get to me, the next time around  Its a hard-earned victory The life that come from you to me Can never be wrong  Grown from a moment and a million miles Here lies the stardust and it slowly dies Borrowed from nothing, come back half alive And the stars, they whisper 'blessings be' as you walk by"
Laundry Room,The Avett Brothers,14597428,"Don't push me out Just a little longer Stall your mother Disregard your father's words Close the laundry door Tiptoe across the floor Keep your clothes on I got all that I can take Teach me how to use The love that people say you made Stop your parents' car I just saw a shooting star We can wish upon it But we won't share the wish we made But I can't keep no secrets I wish that you would always stay Last night I dreamt the whole night long I woke with a head full of songs I spent the whole day I wrote 'em down, but its a shame Tonight I'll burn the lyrics Cause every chorus was your name Break this tired old routine And this time don't make me leave I am a breathing time machine I'll take you all for a ride"
Tiger Mountain Peasant Song,Fleet Foxes,20058467,"Wanderers this morning came by Where did they go, graceful in the morning light? To banner fair, to follow you softly In the cold mountain air  Through the forest, down to your grave Where the birds wait, and the tall grasses wave They do not know you anymore, more, more, more  Dear shadow alive and well How can the body die? You tell me everything Anything true  Into town one morning I went Staggering through premonitions of my death I don't see anybody that dear to me  Dear shadow alive and well How can the body die? You tell me everything Anything true  Jesse I don't know what I have done I'm turning myself to a demon I don't know what I have done I'm turning myself to a demon"
Your Heart Is a Twisted Vine,Marissa Nadler,480337,Many a life I've tried Many tear I've cried Your heart is a twisted vine That loves but None at a time You see None at a time I see you have a lady She brings you your bread and your wine And your heart is a twisted vine That comes but once in a while To me Once in a while Where are you? Sweet Marie I'm floating on an apple tree And I'm telling all the world That I once knew That I'm in love with you Where are you? Sweet honey I'm floating on an apple tree And I'm telling all the world That I once knew That I'm in love with you Many a life I've tried Many tear I've cried Your heart is a twisted vine That loves but None at a time You see None at a time Where am I? Sweet Marie I'm floating on an apple tree And I'm telling all the world That I once knew That I'm in love with you Where are you? Sweet honey I'm floating on an apple tree And I'm telling all the world That I once knew That I'm in love with you
Home,Edward Sharpe & The Magnetic Zeros,389464002,"Alabama, Arkansas, I do love my Ma and Pa Not the way that I do love you Holy moly, me oh my, you're the apple of my eye Girl, I never loved one like you Man, oh, man, you're my best friend, I scream it to the nothingness There ain't nothing that I need Hot and heavy pumpkin pie, chocolate candy, Jesus Christ Ain't nothing please me more than you  Oh, home, let me come home Home is whenever I'm with you Oh, home, let me come home Home is wherever I'm with you  La, la, la, la, take me home Mommy, I'm coming home  I'll follow you into the park, through the jungle, through the dark Girl, I never loved one like you Moats and boats and waterfalls, alleyways and pay phone calls I been everywhere with you (that's true) Laugh until we think we'll die, barefoot on a summer night Never could be sweeter than with you And in the streets you run afree, like it's only you and me Geeze, you're something to see  Oh, home, let me come home Home is whenever I'm with you Oh, home, let me come home Home is wherever I'm with you  La, la, la, la take me home Daddy, I'm coming home  Jade? Alexander? Do you remember that day you fell outta my window? I sure do  you came jumping out after me! Well, you fell on the concrete and nearly broke you ass, you were bleeding all over the place, I rushed you out to the hospital, you remember that? Yes, I do Well there's something I never told you about that night... What didn't you tell me? While you were sitting in the back seat smoking a cigarette you thought was gonna be your last, I was falling deep, deeply in love with you, and I never told you till just now! Aww!  Oh, home, let me come home Home is whenever I'm with you Oh, home, let me come home Home is where I'm alone with you  Home, let me come home Home is wherever I'm with you Home, yes I am home Home is when I'm alone with you Alabama, Arkansas I do love my Ma and Pa Moats and boats and waterfalls Alleyways and payphone calls (Oh home) Home (Oh home) Home Home is wherever I'm with you (Oh home) Home (Oh home) Home Home is wherever I'm with you"
Forget Me Not,The Civil Wars,5108093,"I've been awaiting for you And you've been awaiting for me Tell me that you'll always be true And you'll be the only one for me  Forget me not, my dear, my darling Forget me not, my love  I just wanna hold your hand Hang on every word you say Let's write a song for us And sing until we're old and grey  Forget me not, my dear, my darling Forget me not, my love  I'm coming home real soon Please leave a light on for me Tell me that you'll always be true And you'll be the only one for me Yes, you'll be the only one for me"
The Gardener,The Tallest Man On Earth,34422953,"I sense a runner in the garden Although my judgements known to fail Once built a steamboat in a meadow Cause I'd forgotten how to sail I know the runner's going to tell you There ain't no cowboy in my hair So now he's buried by the daisies So I could stay the tallest man in your eyes, babe I sense a spy up in the chimney From all the evidence I've burned I guess he'll read it in the smoke now And soon to ashes I'll return I know the spy is going to tell you It's not my flag up in the pole So now he's buried by the lilies So I could stay forever more in your eyes, babe I sense a leak inside my phone now From all the lies I have told I know he has your private number And soon he'll make that vicious call I know the leak is going to tell you There ain't now puppy on your leash So now he'll fertilize the roses So I could stay the king you see In your eyes, babe In your eyes, babe So now we're dancing through the garden And what a garden I have made And now that death will grow my jasmine I find it soothing I'm afraid Now there is no need for suspicion There ain't no fraud kissing your hand I won't be lying when I tell you That I'm a Gardener I'm a man In your eyes, babe In your eyes, babe In your eyes, babe In your eyes, babe"
Hello My Old Heart,The Oh Hellos,55161978,"Hello, my old heart How have you been? Are you still there inside my chest? I've been so worried, you've been so still Barely beating at all  Oh, oh, don't leave me here alone Don't tell me that we've grown For having loved a little while Oh, oh, I don't wanna be alone I wanna find a home And I wanna share it with you  Hello, my old heart It's been so long Since I've given you away And every day, I add another stone To the walls I built around you To keep you safe  Oh, oh, don't leave me here alone Don't tell me that we've grown For having loved a little while Oh, oh, I don't wanna be alone I wanna find a home And I wanna share it with you  Hello, my old heart How have you been? How is it being locked away? Don't you worry, in there, you're safe And it's true, you'll never beat But you'll never break  Nothing lasts forever Some things aren't meant to be But you'll never find the answers Until you set your old heart free Until you set your old heart free  Hello, my old heart Hello, my old heart Hello, my old heart Hello, my old heart"
Holocene,Bon Iver,245647445,"'Someway, baby, it's part of me, apart from me' You're laying waste to Halloween You fucked it friend, it's on its head, it struck the street You're in Milwaukee, off your feet  And at once, I knew I was not magnificent  Strayed above the highway aisle Jagged vacance, thick with ice I could see for miles, miles, miles  3rd and Lake, it burnt away, the hallway Was where we learned to celebrate Automatic bought the years you'd talk for me That night you played me 'Lip Parade' Not the needle, nor the thread, the lost decree Saying nothing, that's enough for me  And at once, I knew I was not magnificent  Hulled far from the highway aisle Jagged vacance, thick with ice I could see for miles, miles, miles  Christmas night, it clutched the light, the hallow bright Above my brother, I and tangled spines We smoked the screen to make it what it was to be Now to know it in my memory  And at once, I knew I was not magnificent  High above the highway aisle Jagged vacance, thick with ice I could see for miles, miles, miles"
