Title,Artist,Count,Lyrics
Born in the U.S.A.,Bruce Springsteen,163502815,"Born down in a dead man's town The first kick I took was when I hit the ground You end up like a dog that's been beat too much 'Til you spend half your life just coverin' up  Born in the U.S.A I was born in the U.S.A I was born in the U.S.A Born in the U.S.A  Got in a little hometown jam So they put a rifle in my hand Sent me off to a foreign land To go and kill the yellow man  Born in the U.S.A I was born in the U.S.A I was born in the U.S.A I was born in the U.S.A Born in the U.S.A  Come back home to the refinery Hiring man says 'Son if it was up to me' Went down to see my V.A. man He said 'Son, don't you understand'  I had a brother at Khe Sanh fighting off the Viet Cong They're still there, he's all gone He had a woman he loved in Saigon I got a picture of him in her arms now  Down in the shadow of the penitentiary Out by the gas fires of the refinery I'm ten years burning down the road Nowhere to run ain't got nowhere to go  Born in the U.S.A I was born in the U.S.A Born in the U.S.A I'm a long gone Daddy in the U.S.A Born in the U.S.A Born in the U.S.A Born in the U.S.A I'm a cool rocking Daddy in the U.S.A"
Joker And The Thief,Wolfmother,100045585,"I said the joker is a wanted man He makes his way all across the land See him sifting through the sand So I'll tell you all the story 'Bout the joker and the thief in the night He's always laughing in the midst of power Always living in the final hour There is always sweet in the sour  So we are not goin' home  Can you see the joker flying over As she's standing in the field of clover Watching out everyday? I wonder what would happen if he took her away?  What you see well you might not know You get the feelin' comin' after the glow The vagabond is moving slow So I'll tell you all the story 'Bout the joker and the thief in the night All the people that he see in the night Hold their dreams up to the light The wild beast is searching for sight  And we are not goin' home  Can you see the joker flying over As she's standing in the field of clover Watching out everyday? I wonder what would happen if he took her away?  I said the joker is a wanted man He makes his way all across the land See him sifting through the sand Tell you the story 'bout the the joker and the thief I said, I'll tell you the story 'bout the the joker and the thief I said, I'll tell you the story 'bout the the joker and the thief I said, I'll tell you the story 'bout the the joker and the thief In the night"
You Really Got Me - 2015 Remaster,Van Halen,47730794,"Girl, you really got me now You got me so I don't know what I'm doin' Girl, you really got me now You got me so I can't sleep at night  Yeah, you really got me now You got me so I don't know where I'm goin' yeah Oh yeah, you really got me now You got me so I can't sleep at night You really got me You really got me You really got me  Please, don't ever let me be I always want to be by your side Please, don't ever let me be I only want to be by your side  Girl, you really got me now You got me so I don't know what I'm doing Yeah, you really got me now You got me so I can't sleep at night You really got me You really got me You really got me Oh no, no!  Girl, you really got me now You got me so I don't know what I'm doing Yeah, you really got me now You got me so I can't sleep at night  Yeah, you really got me now You got me so I don't know where I'm goin' yeah Oh yeah, you really got me now You got me so I can't sleep at night You really got me You really got me You really got me  Oh, oh ,oh!"
Pinball Wizard,The Who,83664520,"Ever since I was a young boy, I've played the silver ball From Soho down to Brighton, I must've played 'em all But I ain't seen nothin' like him in any amusement hall That deaf, dumb, and blind kid sure plays a mean pinball  He stands like a statue, becomes part of the machine Feelin' all the bumpers, always playin' clean Plays by intuition, the digit counters fall That deaf, dumb, and blind kid sure plays a mean pinball  He's a pinball wizard, there has to be a twist A pinball wizard's got such a supple wrist  How do you think he does it? I don't know! What makes him so good?  Ain't got no distractions, can't hear no buzzes and bells Don't see no lights a-flashin', plays by sense of smell Always gets the replay, never seen him fall That deaf, dumb, and blind kid sure plays a mean pinball  I thought I was the Bally table king But I just handed my pinball crown to him  Even on my favorite table, he can beat my best Disciples lead him in, and he just does the rest He's got crazy flipper fingers, never seen him fall That deaf, dumb, and blind kid sure plays a mean pinball"
Mary Jane's Last Dance,Tom Petty and the Heartbreakers,10841439,"She grew up in an Indiana town Had a good lookin' mama who never was around But she grew up tall and she grew up right With them Indiana boys on them Indiana nights Well, she moved down here at the age of eighteen She blew the boys away, was more than they'd seen I was introduced and we both started groovin' She said, 'I dig you baby, but I got to keep movin' on Keep movin' on'  Last dance with Mary Jane, one more time to kill the pain I feel summer creepin' in and I'm tired of this town again  Well, I don't know, but I've been told You never slow down, you never grow old I'm tired of screwin' up, tired of going down Tired of myself, tired of this town  Oh, my, my, oh, hell yes Honey, put on that party dress Buy me a drink, sing me a song Take me as I come 'cause I can't stay long  Last dance with Mary Jane, one more time to kill the pain I feel summer creepin' in and I'm tired of this town again  There's pigeons down on Market Square She's standin' in her underwear Lookin' down from a hotel room The nightfall will be comin' soon  Oh, my, my, oh, hell yes You got to put on that party dress It was too cold to cry when I woke up alone I hit my last number and walked to the road  Last dance with Mary Jane, one more time to kill the pain I feel summer creepin' in and I'm tired of this town again"
Through Glass,Stone Sour,173901947,"I'm looking at you through the glass Don't know how much time has passed Oh, God, it feels like forever, but no one ever tells you That forever feels like home, sitting all alone inside your head  'Cause I'm looking at you through the glass Don't know how much time has passed All I know is that it feels like forever, but no one ever tells you That forever feels like home, sitting all alone inside your head  How do you feel? That is the question But I forget you don't expect an easy answer When something like a soul becomes initialized and folded up Like paper towels and little notes, you can't expect a bit of hope  So while you're outside looking in, describing what you see Remember what you're staring at is me  'Cause I'm looking at you through the glass Don't know how much time has passed All I know is that it feels like forever, but no one ever tells you That forever feels like home, sitting all alone inside your head  How much is real? So much to question An epidemic of the mannequins, contaminating everything We thought came from the heart, but never did right from the start Just listen to the noises, null and void instead of voices  Before you tell yourself, it's just a different scene Remember it's just different from what you've seen  I'm looking at you through the glass Don't know how much time has passed And all I know is that it feels like forever, but no one ever tells you That forever feels like home, sitting all alone inside your head 'Cause I'm looking at you through the glass Don't know how much time has passed And all I know is that it feels like forever, but no one ever tells you That forever feels like home, sitting all alone inside your head  And it's the stars, the stars That shine for you And it's the stars, the stars That lie to you, yeah-ah And it's the stars, the stars That shine for you And it's the stars, the stars That lie to you, yeah-ah  I'm looking at you through the glass Don't know how much time has passed Oh, God, it feels like forever, but no one ever tells you That forever feels like home, sitting all alone inside your head 'Cause I'm looking at you through the glass Don't know how much time has passed All I know is that it feels like forever, but no one ever tells you That forever feels like home, sitting all alone inside your head  And it's the stars, the stars That shine for you, yeah-ah And it's the stars, the stars That lie to you, yeah-ah And it's the stars, the stars That shine for you, yeah-ah And it's the stars, the stars That lie to you, yeah, yeah Oh, and the stars Oh, and the stars, they lie"
Numb / Encore,JAY Z,419724898,"Yeah Thank you, thank you, thank you, you're far too kind! (Whoo!) Ah, uh, whoo, yeah! Ready? Whoo, whoo, whoo!  (Can I get a encore, do you want more?) Cookin' raw with the Brooklyn boy So for one last time I need y'all to roar Uh, uh, uh, uh (Yeah) Now, what the hell are you waiting for? After me, there shall be no more So for one last time, nigga, make some noise  Get 'em Jay!  Who you know fresher than Hov'? Riddle me that! The rest of y'all know where I'm lyrically at Can't none of y'all mirror me back, yeah, hearin' me rap Is like hearin' G. Rap in his prime, I'm Young H.O., rap's grateful dead 'Bout to take over the globe, now break bread I'm in Boeing jets, Global Express Out the country but the blueberry still connect On the low but the yacht got a triple deck But when you young, what the fuck you expect? Yep, yep! Grand openin', grand closin' God damn, your man Hov' cracked the can open again Who you gon' find doper than him With no pen, just draw off inspira-tion-tion Soon you gon' see you can't replace him-him With cheap imitations for these generations  Encore, do you want more? Cookin' raw with the Brooklyn boy So for one last time I need y'all to roar Uh, uh, uh, uh (Yeah) Now, what the hell are you waiting for? After me, there shall be no more So for one last time, nigga, make some noise What the hell are you waiting for?  Look what you made me do, look what I made for you Knew if I paid my dues, how will they pay you? When you first come in the game, they try to play you Then you drop a couple of hits, look how they wave to you (Look how they wave to you) From Marcy to Madison Square To the only thing that matters in just a matter of years (Yeah) As fate would have it, Jay's status appears To be at an all-time high, perfect time to say goodbye When I come back like Jordan Wearin' the 45, it ain't to play games with you It's to aim at you, probably maim you If I owe you I'm blowin' you to smithereens Cocksucker, take one for your team And I need you to remember one thing (One thing) I came, I saw, I conquered From record sales, to sold-out concerts So, motherfucker, if you want this encore I need you to scream, 'til your lungs get sore (Come on)  I'm tired of being what you want me to be Feeling so faithless, lost under the surface Don't know what you're expecting of me Put under the pressure of walking in your shoes (Caught in the undertow, just caught in the undertow) Every step that I take is another mistake to you (Caught in the undertow, just caught in the undertow) And every second I waste is more than I can take!  I've become so numb, I can't feel you there Become so tired, so much more aware I'm becoming this, all I want to do Is be more like me and be less like you I've become so numb  Can I get a encore? Do you want more? (More, more, more) I've become so numb So for one last time I need y'all to roar One last time I need y'all to roar"
Warrior,Disturbed,55266139,"I am now an instrument of violence I am a vessel of invincibility I cannot leave this undecided Stepping down to battle another day Remember me for all time This determination is a vital part of me Surrender now, or be counted With the endless masses that I will defeat  Come on bring it, don't sing it Better believe it Broken down, 'til your hope has died Beat down, 'til the victory is mine Stand up and show me some pride And now, are you ready?  I'm one with the warrior, inside My dominance can't be denied Your entire world will turn Into a battlefield, tonight As I look upon you Through the warriors eyes, now I can see the fear that will Ensure my victory, this time  I can't be told to compromise this They'll never doubt the body lying at my feet A most formidable reminder They will speak my name for eternity I have no need of any guidance I am a weapon, powerful beyond belief Seen through the warriors eyes I never need to question how to defeat you  Come on bring it, don't sing it Better believe it Broken down, 'til your hope has died Beat down, 'til the victory is mine Stand up and show me some pride And now, are you ready?  I'm one with the warrior, inside My dominance can't be denied Your entire world will turn Into a battlefield, tonight As I look upon you Through the warriors eyes, now I can see the fear that will Ensure my victory, this time  You can't hide, now I am the warrior So decide, now How theyll remember you Do not hide, now Act like a warrior Show your pride, now Solidify your place in time  I'm one with the warrior, inside My dominance cant be denied Your entire world will turn Into a battlefield, tonight As I look upon you Through the warriors eyes, now I can see the fear that will Ensure my victory, this time I'm one with the warrior, inside The evidence can't be denied The entire world will stare Into this battlefield, tonight As I stand before you With a warriors heart, now I can feel the strength that will Ensure my victory, this time"
Absolute Zero,Stone Sour,69646622,"The bloody angle, the symmetry Your cheap adhesive isn't holding me My mouth is a gun I can shoot, I can show you the truth And I dont need a reason to lie to you No pun intended, no punishment If I offended you, you needed it Ideas are the bombs in your mind, a fissure in time If you dont have a weapon, you cant have mine  I can bleed if I want to bleed I can fail if I feel the need This face is my last confession This life it feels like a prison  Oh, Im not afraid Im giving into grievances again Youre looking at an absolute zero Im not the devil, but I wont be your hero  The catatonic, the sacrilege Your primadonnas are a privilege My god has a need to react, its as simple as that Its better just to settle than face the facts  I can bleed if I want to bleed I can fail if I feel the need This face is my last confession This life it feels like a prison  Oh, Im not afraid Im giving into grievances again Youre looking at an absolute zero Im not the devil, but I wont be your hero  One thing that I cant stand Is when the minutes fight the second hand Ill waste a lifetime's worth just to cling to one more day  No fucking quarter, no premiums The world is stuck in delirium Man is a four-letter word, its really absurd The hate isn't fake its just inferred  Oh, Im not afraid Im giving into grievances again Im down to absolute zero Another zealot with the weight of the fucking world Oh, Im not afraid And I will let you down as I hold you in Youre looking at an absolute zero Im not the devil, but I wont be your hero"
Take The Money And Run,Steve Miller Band,51692242,"Hoo hoo  This here's a story 'bout Billy Joe and Bobbie Sue Two young lovers with nothing better to do Than sit around the house, get high, and watch the tube And here's what happened when they decided to cut loose They headed down to, ooh, old El Paso That's where they ran into a great big hassle Billy Joe shot a man while robbing his castle Bobbie Sue took the money and run Hoo hoo hoo  Go on, take the money and run Go on, take the money and run Hoo hoo hoo Go on, take the money and run Go on, take the money and run Hoo hoo hoo  Billy Mack is a detective down in Texas You know he knows just exactly what the facts is He ain't gonna let those two escape justice He makes his living off of the people's taxes Bobbie Sue, whoa, whoa, she slipped away Billy Joe caught up to her the very next day They got the money, hey You know they got away They headed down south, and they're still running today Singing  Go on, take the money and run Go on, take the money and run Hoo hoo hoo Go on, take the money and run, oh Lord Go on, take the money and run Hoo hoo hoo  Yeah, yeah Go on, take the money and run (Yeah, yeah) Hoo hoo hoo Go on, take the money and run, oh Lord Go on, take the money and run (Yeah, yeah) Hoo hoo hoo Go on, take the money and run, oh Lord"
On Melancholy Hill,Gorillaz,183472572,"Up on Melancholy Hill, there's a plastic tree Are you here with me? Just looking out on the day of another dream Where you can get what you want, but you can't get me So let's set out to sea (love) 'Cause you are my medicine when you're close to me When you're close to me  So call in the submarines, 'round the world we'll go Does anybody know her If we're looking out on the day of another dream? If you can't get what you want, then come with me Up on Melancholy Hill sits the manatee Just looking out for the day When you're close to me When you're close to me When you're close to me"
Raining,The Front Bottoms,4446226,"It was raining when they let me out of the hospital I had nothing in my pockets, still had the bracelet on I still had the bracelet on, oh yeah You and me get the chills at the same time Who would have thought? The exact vibrations On the outside, I was fine But inside, I was all torn up, yeah How do you think that felt? How do you think that felt for me? Yeah Tracy, or should I call you Annmarie? You went flying over all the trees See a house built by a mafia member How do you think that felt? How do you think that felt for me? Yeah How do you think that felt? How do you think that felt for me? On the outside, I was fine But inside, I was all torn up 'Cause I feel absolute fantastic To fall asleep would take some magic To fall asleep would take some magic 'Cause I feel absolute fantastic How do you think that felt? How do you think that felt for me? Yeah How do you think that felt? How do you think that felt for me? Yeah How do you think that felt? How do you think that felt for me? Yeah How do you think that felt? How do you think that felt for me? Yeah How do you think that felt? How do you think that felt for me? Yeah How do you think that felt? How do you think that felt for me? Yeah"
Always,Bon Jovi,168772368,"This romeo is bleeding But you can't see his blood It's nothing but some feelings That this old dog kicked up It's been raining since you left me Now I'm drowning in the flood You see I've always been a fighter But without you I give up Now I can't sing a love song Like the way it's meant to be Well, I guess I'm not that good anymore But baby, that's just me  And I will love you, baby, always And I'll be there forever and a day, always I'll be there till the stars don't shine Till the heavens burst and The words don't rhyme And I know when I die, you'll be on my mind And I'll love you, always  Now your pictures that you left behind Are just memories of a different life Some that made us laugh, some that made us cry One that made you have to say goodbye What I'd give to run my fingers through your hair To touch your lips, to hold you near When you say your prayers try to understand I've made mistakes, I'm just a man When he holds you close, when he pulls you near When he says the words you've been needing to hear I'll wish I was him cause those words are mine To say to you till the end of time  Yeah, I will love you baby, always And I'll be there forever and a day, always  If you told me to cry for you I could If you told me to die for you I would Take a look at my face There's no price I won't pay To say these words to you  Well, there ain't no luck In these loaded dice But baby if you give me just one more try We can pack up our old dreams And our old lives We'll find a place where the sun still shines  And I will love you, baby, always And I'll be there forever and a day, always I'll be there till the stars don't shine Till the heavens burst and The words don't rhyme And I know when I die, you'll be on my mind And I'll love you, always"
Sex & Candy,Marcy Playground,94378163,"Hanging around, downtown by myself And I had so much time to sit and think about myself And then there she was, like double cherry pie Yeah, there she was, like disco super-fly  I smell sex and candy here, mmm Who's that lounging in my chair? Mmm Who's that casting devious stares in my direction? Momma this surely is a dream, yeah Yeah, momma this surely is a dream, dig it  Hanging around, downtown by myself And I've had too much caffeine, and I was thinking about myself And then there she was, in platform double suede Yeah, there she was, like disco lemonade  I smell sex and candy here, mmhmmm Who's that lounging in my chair? Mmhmmm Who's that casting devious stares in my direction? Momma this surely is a dream, yeah Yeah, momma this surely is a dream, dig it Yeah, momma this surely is a dream, yeah  I smell sex and candy here, mmhmmm Who's that lounging in my chair? Mmhmmm Who's that casting devious stares in my direction? Momma this surely is a dream, dig it Yeah, momma this surely is a dream, mmhmmm Yeah, momma this surely is a dream, yeah Yeah, momma this must be my dream"
Radar Love,Golden Earring,57627083,Ive been driving all night My hands wet on the wheel Theres a voice in my head that drives my heel Its my baby calling Says 'I need you here' And its half past four and Im shifting gear  When shes lonely and the longing gets too much She sends a cable coming in from above Dont need no phone at all Weve got a thing thats called Radar Love Weve got a wave in the air Radar Love  The radios playing some forgotten song Brenda Lees 'Coming on Strong' The road has got me hypnotized And Im speeding into a new sunrise  When I get lonely and Im sure Ive had enough She sends her comfort coming in from above Dont need no letter at all Weve got a thing thats called Radar Love Weve got a line in the sky Radar Love  No more speed Im almost there Gotta keep cool now gotta take care Last car to pass here I go And the line of cars drove down real slow And the radio played that forgotten song Brenda Lees 'Coming on Strong' And the newsman sang his same song One more radar love is gone  When I get lonely and Im sure Ive had enough She sends her comfort coming in from above Dont need no letter at all Weve got a thing thats called Radar Love Weve got a line in the sky Radar Love  Weve got a thing thats called Radar Love Weve got a thing thats called Radar Love
Highway Star - Remastered 2012,Deep Purple,75276316,"Nobody going to take my car I'm going to race it to the ground Nobody going to beat my car It's going to break the speed of sound Ooh, it's a killing machine It's got everything Like a driving power Big fat tires and everything  I love it And I need it I bleed it Yeah, it's a wild hurricane  Alright, hold tight I'm a highway star  Nobody going to take my girl I'm going to keep her to the end Nobody going to have my girl She stays close on every bend Ooh, she's a killing machine She's got everything Like a moving mouth Body control And everything  I love her I need her I see her Yeah, she turns me on  Alright, hold tight I'm a highway star   Nobody going to take my head I got speed inside my brain Nobody going to steal my head Now that I'm on the road again Ooh, I'm in heaven again I've got everything Like a moving ground An open road and everything  I love it And I need it I seed it Eight cylinders, all mine  Alright, hold tight I'm a highway star   Nobody going to take my car I'm going to race it to the ground Nobody going to beat my car It's going to break the speed of sound Ooh, it's a killing machine It's got everything Like a driving power Big fat tires and everything  I love it And I need it I bleed it Yeah, it's a mad hurricane  Alright, hold tight I'm a highway star I'm a highway star I'm a highway star"
Alone,I Prevail,31995507,"We used to have it all It was us against the world, but now I've been sleeping on my own Spending all these nights alone, knowing you're not coming home  'Cause you're running through my dreams It's like you're on repeat Feels like eternity And I can't believe  I let you in, you left me out You left me on my own, you left me all alone I let you in, you bled me out You left me skin and bone, you left me all alone  You left me all alone  I would've gave it all Truth be told, I can't believe you're gone Like a dream, I can't recall Now I gotta face the fact that you're never coming back  'Cause you're running through my dreams It's like you're on repeat Feels like eternity And I can't believe  I let you in, you left me out You left me on my own, you left me all alone I let you in, you bled me out You left me skin and bone, you left me all alone You used to run, run through my veins And to be honest, I know I'll never be the same I let you in, you left me out You left me on my own, you left me all alone  You left me all alone  I see you in my dreams, I can't believe you're gone When it's too dark to see, I'll leave the light on I'll leave the light on, I'll leave the light on When it's too dark to see  I let you in, you left me out You left me on my own, you left me all alone I let you in, you bled me out You left me skin and bone, you left me all alone You used to run, run through my veins And to be honest, I know I'll never be the same I let you in, you left me out You left me on my own, you left me all alone"
