Title,Artist,Count,Lyrics
Animals,Nickelback,60076576,"I, I'm driving black on black Just got my license back I got this feeling in my veins this train is coming off the track I'll ask polite if the devil needs a ride 'Cause the angel on my right ain't hanging out with me tonight I'm driving past your house while you were sneaking out I got the car door opened up so you can jump in on the run Your mom don't know that you were missing She'd be pissed if she could see the parts of you that I've been kissing Screamin'  No, we're never gonna quit Ain't nothing wrong with it Just acting like we're animals (Animals) No, no matter where we go 'Cause everybody knows We're just a couple of animals (Animals)  So come on baby, get in Get in, just get in Check out the trouble we're in  You're beside me on the seat Got your hand between my knees And you control how fast we go by just how hard you wanna squeeze It's hard to steer when you're breathing in my ear But I got both hands on the wheel while you got both hands on my gears By now, no doubt that we were heading south I guess nobody ever taught her not to speak with a full mouth 'Cause this was it, like flicking on a switch It felt so good I almost drove into the ditch I'm screamin'  No, we're never gonna quit Ain't nothing wrong with it Just acting like we're animals (Animals) No, no matter where we go 'Cause everybody knows We're just a couple of animals (Animals)  So come on baby, get in Get in, just get in Look at the trouble we're in  We were parked out by the tracks We're sitting in the back and we just started getting busy When she whispered 'What was that?' 'The wind, I think 'cause no one else knows where we are' And that was when she started screamin' 'That's my dad outside the car!' Oh please, the keys, they're not in the ignition Must have wound up on the floor while we were switching our positions I guess they knew that she was missing As I tried to tell her dad it was her mouth that I was kissing Screamin'  No, we're never gonna quit Ain't nothing wrong with it Just acting like we're animals (Animals) No, no matter where we go 'Cause everybody knows We're just a couple of animals (Animals)  So come on baby, get in (We're just a couple of animals) Get in, just get in Ain't nothing wrong with it Check out the trouble we're in (We're just a couple of animals) Get in, just get in"
Fell On Black Days,Soundgarden,60304653,"Whatsoever I feared has come to light And whatsoever I've fought off became my life Just when everyday seemed to greet me with a smile Sunspots have faded, now I'm doin' time, now I'm doin' time  'Cause I fell on black days I fell on black days  Whomsoever I've cured, I've sickened now And whomsoever I've cradled, I've put you down I'm a searchlight soul, they say, but I can't see it in the night I'm only faking, when I get it right, when I get it right  'Cause I fell on black days I fell on black days  How would I know That this could be my fate? How would I know That this could be my fate?  'Til what you wanted to see good has made you blind And what you wanted to be yours has made it mine So, don't you lock up somethin' that you wanted to see fly Hands are for shaking, no, not tying, no, not tying  I sure don't mind a change I sure don't mind a change Sure don't mind... sure don't mind a change I sure don't mind a change  'Cause I fell on black days I fell on black days  How would I know that this could be my fate? How would I know that this could be my fate? How would I know that this could be my fate? How would I know that this could be my fate?  I sure don't mind a change"
Woman,Wolfmother,65088918,"Woman You know you're woman You got to be a woman I got the feeling of love When you're You're talkin' to me You see right through me I got the feeling of love  She's a woman You know what I mean You better listen Listen to me She's gonna set you free Yeah-ah, yeah  Well you're kinda looking at me Like I've got to set you free I can't be nobody Well you're kinda looking at me Like I've got to set you free I can't be nobody  She's a woman You know what I mean You better listen Listen to me She's gonna set you free Yeah-ah, yeah   Woman You know you're woman You got to be a woman I got the feeling of love When you're You're talkin' to me You see right through me I got the feeling of love  She's a woman You know what I mean You better listen Listen to me She's gonna set you free Yeah-ah, yeah"
Wanted Dead Or Alive,Bon Jovi,146171956,"It's all the same, only the names will change Everyday it seems we're wasting away Another place where the faces are so cold I'd drive all night just to get back home  I'm a cowboy On a steel horse I ride I'm wanted dead or alive Wanted dead or alive  Sometimes I sleep, sometimes it's not for days And the people I meet always go their separate ways Sometimes you tell the day by the bottle that you drink And times when you're alone all you do is think  I'm a cowboy On a steel horse I ride I'm wanted, wanted, dead or alive Wanted (wanted) dead or alive  Alive   I'm a cowboy On a steel horse I ride I'm wanted (wanted) dead or alive  I walk these streets, a loaded six string on my back I play for keeps, 'cause I might not make it back I been everywhere, still I'm standing tall I've seen a million faces and I've rocked them all!  'Cause I'm a cowboy On a steel horse, I ride I'm wanted (wanted) dead or alive  And I'm a cowboy I got the night on my side And I'm wanted (wanted) dead or alive  And I ride (and I ride), dead or alive I still drive (still drive), dead or alive Dead or alive Dead or alive Dead or alive Dead or alive"
Zombie,Bad Wolves,131631694,"Another head hangs lowly Child is slowly taken And the violence causes silence Who are we mistaken?  But you see, it's not me, it's not my family In your head, in your head, they are fighting With their tanks and their bombs and their bombs and their drones In your head, in your head, they are crying  What's in your head, in your head? Zombie, zombie, zombie-ie-ie What's in your head, in your head? Zombie, zombie, zombie-ie-ie-ie, oh  Another mother's breaking Heart is taking over When the violence causes silence We must be mistaken  It's the same old theme in 2018 In your head, in your head, they're still fighting With their tanks and their bombs and their guns and their drones In your head, in your head, they are dying  What's in your head, in your head? Zombie, zombie, zombie-ie-ie What's in your head, in your head? Zombie, zombie, zombie-ie-ie-ie, oh   It's the same old theme in 2018 In your head, in your head, they are dying  What's in your head, in your head? Zombie, zombie, zombie-ie-ie What's in your head, in your head? Zombie, zombie, zombie-ie-ie-ie, oh Oh, oh, oh, oh, oh, oh, yeah yeah"
Where's the Revolution,Depeche Mode,17705198,"You've been kept down You've been pushed 'round You've been lied to You've been fed truths Who's making your decisions? You or your religion Your government, your countries You patriotic junkies  Where's the revolution? Come on, people You're letting me down Where's the revolution? Come on, people You're letting me down  You've been pissed on For too long Your rights abused Your views refused They manipulate and threaten With terror as a weapon Scare you till you're stupefied Wear you down until you're on their side  Where's the revolution? Come on, people You're letting me down Where's the revolution? Come on, people You're letting me down  The train is coming The train is coming The train is coming The train is coming So get on board Get on board Get on board Get on board The engine's humming The engine's humming The engine's humming The engine's humming So get on board Get on board Get on board Get on board The train is coming The train is coming The train is coming The train is coming So get on board Get on board Get on board Get on board The engine's humming The engine's humming The engine's humming The engine's humming So get on board Get on board  Where's the revolution? Come on, people You're letting me down Where's the revolution? Come on, people You're letting me down Where's the revolution? Come on, people You're letting me down Where's the revolution? Come on, people You're letting me down"
Jack & Diane,John Mellencamp,114554821,"Little ditty about Jack and Diane Two American kids growin' up in the heartland Jack, he's gonna be a football star Diane's debutante backseat of Jacky's car  Suckin' on a chili dog outside the Tastee Freez Diane's sittin' on Jacky's lap, he's got his hand between her knees Jacky say, 'Hey Diane, lets run off behind a shady tree Dribble off those Bobby Brooks slacks, now do what I please' Say a....  Oh yeah, life goes on Long after the thrill of livin' is gone I say, oh yeah say life goes on Long after the thrill of livin' is gone Now walk on  Jacky sits back, collects his thoughts for the moment Scratches his head and does his best James Dean 'Well then, there Diane, we ought to run off to the city' Diane says, 'Baby, you ain't missin' nothing' But Jacky say a...  Oh yeah, life goes on Long after the thrill of livin' is gone Oh yeah I say life goes on Long after the thrill of livin' is gone  Gonna let it rock, let it roll Let the Bible Belt come and save my soul Holdin on to sixteen as long as you can Changes come around real soon Make us women and men  Oh yeah, life goes on Long after the thrill of livin' is gone Oh yeah they say life goes on Long after the thrill of livin' is gone  A little ditty about Jack and Diane Two American kids doing the best they can"
No Halo,Sorority Noise,5323289,"This last week I slept 8 hours total, I barely sleep Maybe that's why I've been weak The same things that plague you still plaguing me God called you to fulfill a vacancy I tried to see why it wasn't me  So I didn't show up to your funeral But I showed up to your house And I didn't move a muscle I was quiet as a mouse And I swore I saw you in there But I was looking at myself  I'm placing bets against myself And honestly I'm a mess Like a car engulfed in flames I am a wreck Things I should have said through call or text I've just really been so busy and I regret  'Cause if there's no rest for the wicked I'm as evil as it gets Thing I should have said  So I didn't show up to your funeral But I showed up to your house And I didn't move a muscle I was quiet as a mouse And I swore I saw you in there But I was looking at myself  So will you show up to my funeral Will you be wearing white or black? And I know the force is in you It's the energy I lack So if there's a race to heaven I will surely come in last And if there's a race to heaven I will always come in last"
Me and Bobby McGee,Janis Joplin,92407003,"Busted flat in Baton Rouge, waiting for a train When I was feeling nearly faded as my jeans Bobby thumbed a diesel down, just before it rained And rode us all the way to New Orleans I pulled my harpoon out of my dirty red bandana I was playing soft while Bobby sung the blues, yeah Windshield wipers slapping time I was holding Bobby's hand in mine We sang every song that driver knew  Freedom's just another word for nothing left to lose Nothing, I mean nothing, honey if it isn't free, no no Yeah feeling good was easy Lord, when he sang the blues You know feeling good was good enough for me Good enough for me and my Bobby McGee  From the Kentucky coal mines to the California sun Yeah, Bobby shared the secrets of my soul Through all kinds of weather, through everything we done Yeah, Bobby baby kept me from the cold One day up near Salinas, Lord, I let him slip away He's lookin' for that home, and I hope he finds it But I'd trade all of my tomorrows for one single yesterday To be holdin' Bobby's body next to mine  Freedom's just another word for nothing left to lose Nothing, and that's all that Bobby left me Feeling good was easy Lord, when he sang the blues You know feeling good was good enough for me Good enough for me and my Bobby McGee  La da la la la, la da la la la da la La da da la la la Bobby McGee yeah La da la la la, la da la la la da la La da da la la la Bobby McGee yeah La da la la la, la da la la la da la La da da la la la Bobby McGee yeah La da la la la, la da la la la da la La da da la la la Bobby McGee yeah  Lord, I called him my lover, I called him my man I said called him my lover just the best I can and come on And and a Bobby oh, and a Bobby McGee yeah Lo lo lo lo lo lo lo lo lo lo lo lo Hey hey hey Bobby McGee, lord La da la la la, la da la la la la la Hey hey hey, Bobby McGee yeah"
Little Dark Age,MGMT,35812178,Breathing in the dark Lying on its side The ruins of the day Painted with a scar And the more I straighten out The less it wants to try The feelings start to rot One wink at a time  Oh Forgiving who you are For what you stand to gain Just know that if you hide It doesn't go away When you get out of bed Don't end up stranded Horrified with each stone On the stage My little dark age  Picking through the cards Knowing what's nearby The carvings on the face Say they find it hard And the engine's failed again All limits of disguise The humor's not the same Coming from denial  Oh I grieve in stereo The stereo sounds strange I know that if you hide It doesn't go away If you get out of bed And find me standing all alone Open-eyed Burn the page My little dark age  I grieve in stereo The stereo sounds strange You know that if it hides It doesn't go away If I get out of bed You'll see me standing all alone Horrified On the stage My little dark age  Giddy with delight Seeing what's to come The image of the dead Dead ends in my mind  Policemen swear to God Love's seeping from the guns I know my friends and I Would probably turn and run If you get out of bed Come find us heading for the bridge Bring a stone All the rage My little dark age  I grieve in stereo The stereo sounds strange I know that if you hide It doesn't go away If you get out of bed And find me standing all alone Open-eyed Burn the page My little dark age  All alone Open-eyed Burn the page My little dark age
Dark Necessities,Red Hot Chili Peppers,215489210,"Comin' on to the light of day, we got Many moons that are deep at play so I Keep an eye on the shadow smile to see what it has to say You and I both know, everything must go away Ah, what do you say? Spinnin' knot that is on my heart is like a Bit of light in a touch of dark, you got Sneak attack from the zodiac but I see your fire spark Eat the breeze and go, blow by blow and go away Oh, what do you say? Yeah  You don't know my mind, you don't know my kind Dark necessities are part of my design and Tell the world that I'm falling from the sky Dark necessities are part of my design  Stumble down to the parking lot, you got No time for the afterthought, they're like Ice Cream for an Astronaut, well, that's me looking for we Turn the corner and find the world at your command Playin' the hand, yeah  You don't know my mind, you don't know my kind Dark necessities are part of my design Tell the world that I'm falling from the sky Dark necessities are part of my design  Do you want this love of mine? Darkness helps us all to shine Do you want it, do you want it now? Do you want it all the time? But darkness helps us all to shine Do you want it, do you want it now?  Ah, pick you up like a paperback with the Track record of a maniac so I Move it in and we unpack, it's the same as yesterday Any way we roll, everything must go away Oh, what do you say? Yeah  You don't know my mind, you don't know my kind Dark necessities are part of my design Tell the world that I'm falling from the sky and Dark necessities are part of my design  Ah-ah-ah Ah-ah Ah-ah-ah Ah-ah Ah-ah-ah Ah-ah Ah-ah-ah Ah-ah"
Monster,Hands Like Houses,4996492,"Digging down, digging down, digging down in the dirt Sweat it out, sweat it out till it doesnt burn In the dark, in the dark it can hear when I breathe Now its closing in on me  Its getting louder now, its getting louder now Dont make another sound (I can feel it coming to life) Its getting closer now, its getting closer now Its gonna run me down (I can feel it coming to life) I can feel it coming to life I can feel it coming  Take me to my grave, save me (I can feel it coming to life) Chain me to my cage, save me (I can feel it coming to life)  Trying to feel, trying to heal, trying to kill the disease Picking flesh, picking bone from between my teeth No sleep, no sleep when you run with the beasts (No sleep, no sleep) Now theyre closing in on me  Its getting louder now, its getting louder now Dont make another sound (I can feel it coming to life) Its getting closer now, its getting closer now Dont let it take me out (I can feel it coming to life)  Take me to my grave, save me I can feel it coming to life Chain me to my cage, save me I can feel it coming to life I can feel it coming to life I can feel it coming to life  Its killing me, killing me, killing me, killing me, killing me Its killing me slow, killing me slow Its killing me, killing me, killing me, killing me, killing me Its killing me slow, killing me slow Its killing me, killing me, killing me, killing me, killing me Its killing me slow, killing me slow  Take me to my grave, save me I can feel it coming to life Chain me to my cage, save me I can feel it coming to life (From the inside out) I can feel it coming to life (From the inside out) I can feel it coming to life I can feel it coming to life Yeah, I can feel it coming to life"
The Thunder Rolls - Cover,All That Remains,14562786,Three thirty in the morning Not a soul in sight The city's looking like a ghost town On a moonless summer night Raindrops on the windshield There's a storm moving in He's heading back from somewhere That he never should have been  And the thunder rolls And the thunder rolls  Every light is burning In a house across town She's pacing by the telephone In her faded flannel gown Asking for a miracle Hoping she's not right Praying it's the weather That's kept him out all night  And the thunder rolls And the thunder rolls  The thunder rolls And the lightning strikes Another love grows cold On a sleepless night As the storm blows on Out of control Deep in her heart The thunder rolls  She's waiting by the window When he pulls into the drive She rushes out to hold him Thankful he's alive But on the wind and rain A strange new perfume blows And the lightning flashes in her eyes And he knows that she knows  And the thunder rolls And the thunder rolls And the thunder rolls!  The thunder rolls And the lightning strikes Another love grows cold On a sleepless night As the storm blows on Out of control Deep in her heart The thunder rolls  Deep in her heart Deep in her heart The thunder rolls The thunder rolls The thunder rolls on And the thunder rolls
I Stand Alone,Godsmack,107771175,"I've told you this once before: can't control me If you try to take me down, you're gonna break I feel your every nothing that you're doing for me I'm thinking you ought to make your own way  I stand alone inside I stand alone  You're always hiding behind your so-called goddess So what? You don't think that we can see your face? Resurrected back before the final falling I'll never rest until I can make my own way I'm not afraid of fading  I stand alone Feeling your sting down inside me I'm not dying for it I stand alone Everything that I believe is fading I stand alone inside I stand alone  And now it's my time (Now it's my time) It's my time to dream (It's my time to dream) Dream of the skies (Dream of the skies) Make me believe that this place isn't plagued by the poison in me Help me decide if my fire will burn out before you can breathe Breathe into me  I stand alone inside I stand alone  I stand alone Feeling your sting down inside me I'm not dying for it I stand alone Everything that I believe is fading I stand alone Inside I stand alone  Inside I stand alone Inside I stand alone Inside"
Runnin' Wild,Airbourne,31185604,"I've got the wind at my back and my foot to the floor I ain't comin' back to you no more I'm sick of your shit and your moaning whine I'm leaving you for good come rain or shine You can cry me a river, cry me a river of tears Yeah you can cry all you like but it won't change my mind I gotta get away get you outta my life... You got me runnin' wild and free Runnin' wild and free You got me runnin' wild and free Runnin' wild and free Gonna drive all day gonna drive all night Whatever it takes to get to the light I'm running on rage I'm outta control My anger for you is like hot burning coal So you can cry me a river, cry me a river of tears Yeah you can cry all you like but it won't change my mind I gotta get away get you outta my life... You got me runnin' wild and free Runnin' wild and free You got me runnin' wild and free Runnin' wild and free You got me runnin' wild, wild and free The open road is all I need You got me runnin' wild runnin' free It's never gonna be like it used to be Hey, Hey, Hey Hey, Hey, Hey Hey, Hey, Hey Hey, Hey, Hey No I won't turn around I won't turn back I've made up my mind and that's a fact It's over baby I'm hangin' up this phone But before you I go there's just one thing you should know... I hope you drown in your river drown in your river of tears Yeah you can cry all you like but it won't change my mind I gotta get away get you outta my life... You got me runnin' wild and free Runnin' wild and free You got me runnin' wild and free Runnin' wild and free Yeah you got me runnin' wild and free Runnin' wild and free You got me runnin' wild and free Runnin' wild and free You got me runnin' wild, wild and free The open road is all I need You got me runnin' wild runnin' free It's never gonna be like it used to be Hey, Hey, Hey Hey, Hey, Hey Hey, Hey, Hey Hey, Hey, Hey"
Angel,Theory of a Deadman,77329831,"Im in love with an angel, heaven forbid Made me a believer with the touch of her skin Id go to hell and back with you Stay lost in what we found Worlds apart we were the same Until we hit the ground  Maybe Im crazy, maybe Im weak Maybe Im blinded by what I see You wanted a soldier but it wasn't me Cause I could never set you free So fly on your own Its time I let you go Go go  Im in love with an angel whos afraid of the light Her halo is broken but there's fight in her eyes  Walls are built to keep us safe Until theyre crashing down Worlds apart we were the same Until you hit the ground  Maybe Im crazy, maybe Im weak Maybe Im blinded by what I see You wanted a soldier but it wasn't me Cause I could never set you free So fly on your own Its time I let you go Go go  Walls are built to keep us safe Until theyre crashing down Worlds apart we were the same Until you hit the ground  Maybe Im crazy, maybe Im weak Maybe Im blinded by what I see You wanted a soldier but it wasn't me Cause I could never set you free So fly on your own Its time I let you go So fly on your own Its time I let you go Go go"
Hard To Handle,The Black Crowes,57338541,"Baby, here I am, I'm a man on the scene I can give you what you want but you got to come home with me I've got some good old lovin' and I got some more in store When I get through throwin' it on you, you got to come back for more  Boys and things that come by the dozen That ain't nothin' but drugstore lovin' Hey little thing, let me light your candle Cause mama, I'm sure hard to handle now, yessiram  Action speaks louder than words and I'm a man of great experience I know you got another man but I can love you better than him Take my hand, don't be afraid, I'm gonna prove every word I say I'm advertising love for free, so you can place your ad with me  Boys will come along, a dime by the dozen That ain't nothing but ten cent lovin' Hey little thing, let me light your candle Cause mama I'm sure hard to handle now, yessiram Yeah Hard to handle now Oh baby  Baby, here I am, I'm a man on your scene I can give you what you want but you got to come home with me I've got some good old lovin' and I got some more in store When I get through throwin' it on you, you got to come a-runnin' back for more  Boys will come along, a dime by the dozen That ain't nothing but drugstore lovin' Hey little thing, let me light your candle Cause mama I'm sure hard to handle now, yessiram Hard Hard to handle now Oh yeah, yeah yeah yeah   Boys will come along, a dime by the dozen That ain't nothing but ten cent lovin' Hey little flame, let me light your candle cause mama I'm sure hard to handle now, yessiram Yeah So hard to handle now Oh yeah  Baby! Good lovin' Baby! Baby! Ohh, good lovin' I need good lovin' I got to have, oh yeah Yeah So hard to handle, now, yeah"
