Title,Artist,Count,Lyrics
The Diary of Jane - Single Version,Breaking Benjamin,231345656,"If I had to, I would put myself right beside you So let me ask, 'Would you like that? Would you like that?' And I don't mind if you say this love is the last time So now I'll ask, 'Do you like that? Do you like that?' (No!)  Something's getting in the way Something's just about to break I will try to find my place in the diary of Jane So tell me how it should be  Try to find out what makes you tick As I lie down, sore and sick Do you like that, do you like that? There's a fine line between love and hate And I don't mind, just let me say 'That I like that, I like that'  Something's getting in the way Something's just about to break I will try to find my place in the diary of Jane As I burn another page, as I look the other way I still try to find my place in the diary of Jane So tell me how it should be  Desperate, I will crawl Waiting for so long No love, there is no love Die for anyone What have I become?  Something's getting in the way Something's just about to break I will try to find my place in the diary of Jane As I burn another page, as I look the other way I still try to find my place in the diary of Jane"
The Scientist,Coldplay,759009328,"Come up to meet you, tell you I'm sorry You don't know how lovely you are I had to find you, tell you I need you Tell you I set you apart Tell me your secrets, and ask me your questions Oh, let's go back to the start Running in circles, coming up tails Heads on a science apart  Nobody said it was easy It's such a shame for us to part Nobody said it was easy No one ever said it would be this hard Oh, take me back to the start  I was just guessing at numbers and figures Pulling the puzzles apart Questions of science, science and progress Do not speak as loud as my heart Tell me you love me, come back and haunt me Oh, and I rush to the start Running in circles, chasing our tails Coming back as we are  Nobody said it was easy Oh it's such a shame for us to part Nobody said it was easy No one ever said it would be so hard I'm going back to the start  Oh-ooh ooh-ooh-ooh-ooh Aah-ooh ooh-ooh-ooh-ooh Oh-ooh ooh-ooh-ooh-ooh Oh-ooh ooh-ooh-ooh-ooh"
Fake It,Seether,152126535,"Who's to know if your soul will fade at all? The one you sold to fool the world You lost your self esteem along the way, yeah  Good God, you're coming up with reasons Good God, you're dragging it out And good God, it's the changing of the seasons I feel so raped, so follow me down and just  Fake it if you're out of direction Fake it if you don't belong Yeah, fake it if you feel like infection Whoa, you're such a fucking hypocrite  You should know that the lies won't hide your flaws No sense in hiding all of yours You gave up on your dreams along the way, yeah  Good God, you're coming up with reasons Good God, you're dragging it out And good God, it's the changing of the seasons I feel so raped, so follow me down and just  Fake it if you're out of direction Fake it if you don't belong Yeah, fake it if you feel like infection Whoa, you're such a fucking hypocrite  Whoa  I can fake with the best of anyone I can fake with the best of them all I can fake with the best of anyone I can fake it all  Whos to know if your soul will fade at all? The one you sold to fool the world You lost your self esteem along the way, yeah!  Good God, you're coming up with reasons Good God, you're dragging it out And good God, it's the changing of the seasons I feel so raped, man, follow me down and just  Fake it if you're out of direction Fake it if you don't belong Yeah, fake it if you feel like infection Whoa, you're such a fucking hypocrite  Fake it if you're out of direction Fake it if you don't belong Yeah, fake it if you feel like infection Whoa, you're such a fucking hypocrite"
Do Your Worst,Rival Sons,14845964,"See that stranger coming over here Though you don't recognise him, I know your preacher will Got a voice like sugar, sugar in your teeth And he could sing you any song now Sing it sweeter than me  Blind your eyes Steal your tongue Take it when you're old, but But he likes 'em young  Oh my, oh my baby Devil's gonna get you if I don't first Take my, take my body Take my body and do your worst Oh my, oh my baby Devil's gonna get you if I don't first Take my, take my body Take my body and do your worst  If you see that stranger coming on the track I can hear your mama just calling you back Hit you like a fever, fever deep And I touch you like a thief and leave your pockets clean  Blind your eyes Steal your tongue Get you when you're old now But he likes 'em young  Oh my, oh my baby Devil's gonna get you if I don't first Take my, take my body Take my body and do your worst Oh my, oh my baby Devil's gonna get you if I don't first Take my, take my body Take my body and do your worst  Oh my, oh my baby Devil's gonna get you if I don't first Take my, take my body Take my body and do your worst Oh my, oh my baby Devil's gonna get you if I don't first Take my, take my body Take my body and do your worst"
My Little RnR,Danko Jones,6753016,"You look so good when you get out of bed You're always ready to go I caught you looking like a million bucks When you walk out the door You've got something they call attitude Dripping all over the floor Nobody says nothing, they just make their assumptions And now you got them on all fours Just need my fix that sticks And all I gotta say to you is Oh baby, you're my little rock'n roll And no matter what you do, I'm gonna tattoo you On the back of my left shoulder Oh baby, you're my little rock'n roll And I don't mean to brag, when you fly your flag I salute it like I'm a soldier You get looks when you walk down the street Hanging off on my arm You shake they shiver and you laugh out loud You know when to turn on the charm Nobody minds it and they like it alot When you're walking down the strip You get away with most anything Especially when you're licking your lips Can't give my girl the best Cause all I gonna say to you is Oh baby, you're my little rock'n roll And no matter what you do, I'm gonna tattoo you On the back of my left shoulder Oh baby, you're my little rock'n roll It's never been a smooth ride with you by my side It's like riding on a roller coaster Aha-aha-aha-aha Aha-aha-aha Aha-aha-aha-aha Aha-aha-aha Oh baby just do what you do Come on baby you know you never lose You got the moves and you got that soul 'Cause you're my little rock'n roll Oh baby, you're my little rock'n roll And I don't mean to brag when you fly your flag I salute it like I'm a soldier Oh baby, you're my little rock'n roll It's never been a smooth ride with you by my side It's like riding on a roller coaster Oh baby, you're my little rock'n roll And no matter what you do, I'm gonna tattoo you On the back of my left shoulder"
Click Click Boom,Saliva,93085337,"All those Saturdays when kids go out and play Yo, I was up in my room  I let the stereo blaze Wasn't faded, not jaded Just a kid with a pad and pen and a big imagination All this, I seek, I find I push the envelope to the line Make it, break it, take it Until I'm overrated  Click, click, boom! I'm comin' down on the stereo Hear me on the radio Click, click, boom! I'm comin' down with a new style And you know it's buck wild Click, click, boom! I'm on the radio station Tourin' 'round the nation Leavin' the scene in devastation  I can see it in my mind I can see it in their eyes It's close enough to touch it now But far away enough to die What the hell is wrong with me? My mom and dad weren't perfect But still you don't hear no cryin' ass-bitchin' from me Like there seems to be on everybody's CD So just sit back and relax and let me have your head for a minute I can show you somethin' in it that has yet to be presented, oh, yeah!  Click, click, boom! I'm comin' down on the stereo Hear me on the radio Click, click, boom! I'm comin' down with a new style And you know it's buck wild Click, click, boom! I'm on the radio station Tourin' 'round the nation Leavin' the scene in devastation  Why have I clouded up my mind? Why's my mother always right? And will I make it 'til the end Or will I crawl away and die?  All those Saturdays when kids go out and play Yo, I was up in my room  I let the stereo blaze On Saturdays when kids go out and play I was up in my room  I let the stereo blaze It's all inside of me, it's all inside of me It's all inside of me, it's all inside of my head It's all inside of me, it's comin' over me It's all inside of me, it's all inside my head, yeah!  Click, click, boom! I'm comin' down on the stereo Hear me on the radio Click, click, boom! I'm comin' down with a new style And you know it's buck wild  Everybody, everybody, come on! Come on, come on! Everybody, come on! Come on, come on! Click, click, boom! Come on, come on! Everybody, come on! Come on, come on! Click, click, boom! Come on, come on! Everybody, come on! Come on, come on! Click, click, boom! Come on, come on! Everybody, come on! Come on, come on!"
Cat Scratch Fever,Ted Nugent,27217621,"Well, I don't know where they come from but they sure do come I hope they comin' for me And I don't know how they do it but they sure do it good I hope they're doin' it for free  They give me cat scratch fever Cat scratch fever  Well, the first time that I got it I was just ten years old I got it from some kitty next door An' I went to see the doctor and he gave me the cure I think I got it some more  They give me cat scratch fever Cat scratch fever I got a bad scratch fever The cat scratch fever  It's nothin' dangerous I feel no pain I've got the choo-choo train You know you got it when you, you're going insane It makes a grown man cry, cry, oh won't you make my bed   Well, I make the pussy purr with the stroke of my hand They know they gettin' it from me They know just where to go when they need their lovin' man They know I'm doin' it for free  I give them cat scratch fever Cat scratch fever They got a bad scratch fever The cat scratch fever   Cat scratch fever Cat scratch fever Cat scratch fever Cat scratch fever  Cat scratch fever Cat scratch fever"
My Curse,Killswitch Engage,91245548,"I watched you walk away Hopeless, with nothing to say I strain my eyes Hoping to see you again  This is my curse, the longing This is my curse, time This is my curse, the yearning This is my curse There is love burning to find you Will you wait for me? Will you be there?  Your silence haunts me But still I hunger for you  This is my curse, the wanting This is my curse, time This is my curse, the yearning This is my curse There is love burning to find you Will you wait for me?  And still I want And still I ache But still I wait  To see you again Dying, inside, these walls Dying, inside, these walls And I see your face in these tears In these tears And I see your face  There is love There is love There is love There is love There is love There is love There is love There is love"
Hail to the King,Avenged Sevenfold,215030319,"Watch your tongue or have it cut from your head Save your life by keeping whispers unsaid Children roam the streets now orphans of war Bodies hanging in the streets to adore Royal flames will carve a path in chaos Bringing daylight to the night (night) Death is riding in to town with armor They come to take all your rights  Hail to the king Hail to the one Kneel to the crown Stand in the sun Hail to the king Hail Hail Hail The King  Blood is spilled while holding keys to the throne Born again but its too late to atone No mercy from the edge of the blade Dare escape and learn the price to be paid Let the water flow in shades of red now Arrows black out all the light (light) Death is riding in to town with armor They come to grant you your rights  Hail to the king Hail to the one Kneel to the crown Stand in the sun Hail to the king Hail Hail Hail The King   There's a taste of fear (Hail, hail, hail) When the henchmen call (Hail, hail, hail) Iron fist to tame them (Hail, hail, hail) Iron fist to claim it all  Hail to the king Hail to the one Kneel to the crown Stand in the sun Hail to the king Hail to the one Kneel to the crown Stand in the sun Hail to the king Hail Hail Hail The King"
Life Itself,Glass Animals,66205372,"Daddy was dumb, said that Id be something special Brought me up tough but I was a gentle human Said that he loved each of my two million freckles When I grew up was gonna be a superstar  I can't get a job so I live with my mum I take her money but not quite enough I sit in the car and I listen to static She said I look fat but I look fantastic  Come back down to my knees Gotta get back, gotta get free Come back down to my knees Lean back now, lean back and breathe Come back down to my knees Gotta get back, gotta get free Come back down to my knees Lean back now, lean back and breathe  I'm waking up, lost in boxes outside Tesco Look like a bum sipping codeine Coca-Cola Thought that I was northern Camden's own Flash Gordon Sonic ray gun, gonna be a superstar  I can't get a job so I live with my mum I take her money but not quite enough I make my own fun in grandmama's basement Said I look mad, she said I look wasted  Cut back down to my knees Gotta get back, gotta get free Cut back down to my knees Lean back now, lean back and breathe Cut back down to my knees Gotta get back, gotta get free Cut back down to my knees Lean back now, lean back and breathe   Cut back down to my knees Gotta get back, gotta get free Cut back down to my knees Lean back now, lean back and breathe Cut back down to my knees Gotta get back, gotta get free Cut back down to my knees Lean back now, lean back and breathe Cut back down to my knees Gotta get back, gotta get free Cut back down to my knees Lean back now, lean back and breathe"
California Dreamin' - Single Version,The Mamas & The Papas,201095046,All the leaves are brown (All the leaves are brown) And the sky is gray (And the sky is gray) I've been for a walk (I've been for a walk) On a winter's day (On a winter's day) I'd be safe and warm (I'd be safe and warm) If I was in L.A (If I was in L.A.) California dreamin' (California dreamin') on such a winter's day  Stopped in to a church I passed along the way Well I got down on my knees (got down on my knees) And I pretend to pray (I pretend to pray) You know the preacher likes the cold (preacher likes the cold) He knows I'm gonna stay (knows I'm gonna stay) California dreamin' (California dreamin') on such a winter's day   All the leaves are brown (All the leaves are brown) And the sky is gray (And the sky is gray) I've been for a walk (I've been for a walk) On a winter's day (On a winter's day) If I didn't tell her (If I didn't tell her) I could leave today (I could leave today) California dreamin' (California dreamin') on such a winter's day California dreamin' on such a winter's day California dreamin' on such a winter's day
Is There Anybody out There?,Machine Head,27606184,"Is there anybody out there? Is there anybody out there? Is there anybody out there? Is there anybody out there? Come on Come on Come on Is there anybody there? Come on Here's a little something I was born as a bastard, no father, no master A shadow in silence left searching for answers Put up for adoption and left with no option Another kid fostered to fester, forgotten Take a look into these desperate eyes As theyre cast into the wretched hive But I aint going down alone Is there anybody out there? Anybody listening to me? Is anybody else scared? The paranoia drops me to my knees Does anybody feel lonely? Disconnected from the things I see Is there anybody out there? Anybody out there just like me? Im choking on these words and I cant breathe Come on Come on Come on Is there anybody there? Come on Come on Lemme say this Now I stand as a father, to men with no honor Ashamed of the racists I used to call brothers 'Cause no flag can mean bravery When bloodied by slavery The rebel, a devil, disguised as a savior And the sickening feeling in the air Is the fear to speak that no one dares So will I stand here all alone? Is there anybody out there? Anybody listening to me? Is anybody else scared? The paranoia drops me to my knees Does anybody feel lonely? Disconnected from the things I see Is there anybody out there? Anybody out there just like me? Im choking on these words and I cant breathe Live my life like Ill die tonight Dream like Ill live forever Live my life like Ill die tonight Dream like Ill live forever (Is there anybody out there?) I have roared at the world for years (Is there anybody out there?) Doesnt anybody hear me? (Is there anybody out there?) This burden suffered, Ive paid the cost (Is there anybody out there?) Not all who wander are lost Is there anybody Is there anybody Is there anybody Is there anybody out there? Anybody listening to me? Is anybody else scared? The paranoia drops me to my knees Does anybody feel lonely? Disconnected from the things I see Is there anybody out there? Anybody out there just like me? Im choking on these words and I cant breathe Come on Come on Come on Is there anybody there? Come on Come on Is there anybody Is there anybody Is there anybody out there?"
Pride (In The Name Of Love) - Remastered 2009,U2,79432849,"One man come in the name of love One man come and go One man come he to justify One man to overthrow  In the name of love What more in the name of love? In the name of love What more in the name of love?  One man caught on a barbed wire fence One man he resist One man washed up on an empty beach One man betrayed with a kiss  In the name of love What more in the name of love? In the name of love What more in the name of love?  Nothing like love There's nothing like love Nobody like you There's nobody like you  Early morning, April 4 Shot rings out in the Memphis sky Free at last, they took your life They could not take your pride  In the name of love What more in the name of love? In the name of love What more in the name of love?  In the name of love What more in the name of love? In the name of love What more in the name of love?"
You're The One,Greta Van Fleet,20439866,"Babe, aint no denying That Ive got you in my head Girl, Id be flying If you stood yourself and said  Youre the one I want Youre the one I need Youre the one I had So come on back to me  Babe, youre so young and pretty But youre evil, you oughta know Darling, aint that a pity Won't you stand yourself and show  Youre the one I want Youre the one I need Youre the one I had So come on back to me Yeah  See, where weve been Wont you hold my hand and stay awhile  Youre the one I want Youre the one I need Youre the one I had So come on back to me Youre the one I want Youre the one I need Youre the one I, youre the one I had So come on back to me Yeah, come on baby"
Something Human,Muse,25581587,"My circuits have blown I know it's self-imposed And all I have shared, and all I have loved Is all I'll ever own But something has changed I feel so alive My life just blew up, I'd give it all up I'll depressurize  Ten thousand miles left on the road Five-hundred hours 'til I am home I need something human, human Human, human  Let's face all our fears Come out of the shade Let's burn all the money, absolve all the lies And wake up unscathed The big picture's gone Replaced with visions of you Now life can begin, I've cleansed all my sins I'm about to break through  Five thousand miles left on the road Two-hundred hours 'til I am home I need something human, human Human, human  And I need the touch And something human, human  Less than a mile left on the road I will be crawling through your door I need something human, human Human, human  And I need your love And something human, human"
Such A Simple Thing,Ray LaMontagne,59505698,"Tell me what you're feeling I can take the pain Tell me that you mean it That you won't leave again  Tell me what your heart wants Such a simple thing My heart is like paper Yours is like a flame I can't make you see If you don't by now I'll get through these changes Somehow, somehow  Take it if you want it I'm so tired I just don't care Can't you see how much you hurt me? It's like I wasn't there  Tell me what your heart wants Such a simple thing My heart is like paper Yours is like a flame My heart is like paper Yours is like a flame I can't make you see If you don't by now I'll get through these chains Somehow, somehow   Tell me what your heart wants Such a simple thing My heart is like paper Yours is like a flame My heart is like paper Yours is like a flame"
Silvery Sometimes (Ghosts),The Smashing Pumpkins,6138402,"Blur like a rocket Torch like a dying sun Snap like a dragon Dive like a pelican Kingdoms of my kingdom come Skip like a prophet Spit like a poets gun But say how long can this go on? Stumbling before you speak Stunning and stunning and stunning the black You turn turncoat Inward to seek out all your hopes It's your signals That hurts me most  Were in the middle Were in the middle Ghosts Were in the middle Were in the middle Ghosts  Rule like a tyrant Make like a valentine Tear like a siren Sulk like a sunken mine Kingdoms of my kingdom come Its all but one, so Row like a felon Drown like a captain's son But say how long can this go on?  Were in the middle Were in the middle Ghosts Were in the middle Were in the middle Ghosts  Stumbling before you speak Stunning and stunning with cannons to lead And tigers tight You scan the fields, someone dies tonight Its tragic, but at least its not you  Were in the middle Were in the middle Ghosts Were in the middle Were in the middle Ghosts Were in the middle Were in the middle Ghosts Were in the middle Were in the middle Ghosts"
Little Sister,Queens of the Stone Age,36570292,"Hey, sister, why you all alone? I'm standing out your window Hey, little sister, can I come inside, dear? I want to show you all my love I want to be the only one I know you like nobody ever, baby  Little sister, can't you find another way? No more living life behind a shadow Little sister, can't you find another way? No more living life behind a shadow  You whisper secrets in my ear Slowly dancing cheek to cheek Such a sweet thing when you open up, baby They say I'll only do you wrong Come together 'cause I understand Just who you really are, yeah, baby  Little sister, can't you find another way? No more living life behind a shadow Little sister, can't you find another way? No more living life behind a shadow A shadow"
Porn Star Dancing,My Darkest Days,60635871,"Kelly won't kiss my friend Cassandra Jessica won't play ball Mandy won't share her friend Miranda Doesn't anybody live at all? Amanda won't leave me empty-handed Got her number from a bathroom stall Brandy just got way too much baggage And that shit just gets old  But I got a girl who can put on a show The dollar decides how far you can go  She wraps those hands around that pole She licks those lips and off we go She takes it off nice and slow Because that's pornstar dancin' She don't play nice, she makes me beg She drops that dress around her legs And I'm sittin' right by the stage for this Pornstar dancin'  Your body's lightin' up the room I want a naughty girl like you There's nothing hotter than a..  Stacy's gonna save herself for marriage But that's just not my style She's got a pair that's nice to stare at But I want girls gone wild  But I know a place where there's always a show The dollar decides how far you can go  She wraps those hands around that pole She licks those lips and off we go She takes it off nice and slow Because that's pornstar dancin' She don't play nice, she makes me beg She drops that dress around her legs And I'm sittin' right by the stage for this Pornstar dancin'  Your body's lightin' up the room I want a naughty girl like you Let's throw a party just for two You know those normal girls won't do  They won't do, I need a girl that's kinda frisky Drinkin' with the fellas, takin' shots and gettin' tipsy We always wanna party 'cause she sexy as hell And if I ever get in trouble, bailin' me outta jail 'Cause she a stone cold stunna, hotta than the summer When she step up in the club, every man and woman want her She make me wanna get a stripper pole up in my home 'Cause her porn star dancin' got me in the zone  She wraps those hands around that pole She licks those lips and off we go She takes it off nice and slow Because that's pornstar dancin' She don't play nice, she makes me beg She drops that dress around her legs And I'm sittin' right by the stage for this Pornstar dancin'"
Beds Are Burning,Midnight Oil,91142158,"Out where the river broke The bloodwood and the desert oak Holden wrecks and boiling diesels Steam in forty-five degrees  The time has come to say fair's fair To pay the rent, to pay our share The time has come, a fact's a fact It belongs to them, let's give it back  How can we dance when our earth is turning? How do we sleep while our beds are burning? How can we dance when our earth is turning? How do we sleep while our beds are burning?  The time has come to say fair's fair To pay the rent now, to pay our share  Four wheels scare the cockatoos From Kintore, east to Yuendemu The Western Desert lives and breathes In forty-five degrees  The time has come to say fair's fair To pay the rent, to pay our share The time has come, a fact's a fact It belongs to them, let's give it back  How can we dance when our earth is turning? How do we sleep while our beds are burning? How can we dance when our earth is turning? How do we sleep while our beds are burning?  The time has come to say fair's fair To pay the rent now, to pay our share The time has come, a fact's a fact It belongs to them, we're gonna give it back  How can we dance when our earth is turning? How do we sleep while our beds are burning? How can we dance when our earth is turning? How do we sleep while our beds are burning?"
